sentence_id,speaker,text,timestamp_start,timestamp_end,session,speaker_role,lm_positive,lm_negative,lm_net_sentiment,word_count
39,Martin Viecha,"Thank you, Ms. Doherty. Please note that this is the final opportunity to submit any proxies for them to be counted. I declare the polls are now closed. Based on the proxies that we have previously received, I’d like to announce, on a preliminary basis, that our stockholders have approved the recommendations of the Tesla Board on all agenda items, except Item 2, regarding the reduction of director terms to 2 years; Item 5 for an advisory vote regarding the reduction of director terms to 1 year; and Item 6 for an advisory vote regarding additional reporting on diversity and inclusion efforts.",,,management_discussion,executive,1.0,0.0,0.01020408163265306,98.0
40,Martin Viecha,"While over 99% of shares present are entitled to vote on Item 2, did so as recommended by the Board, unfortunately, less than 66.7% of our total outstanding shares, which were required to approve this item, submitted votes for this item. After the final tabulation is completed, we will formally announce the results of the voting by filing a Form 8-K within 4 business days of today’s meeting. That concludes the official business of today’s shareholder meeting, which is now adjourned.",,,management_discussion,executive,0.0,1.0,-0.012658227848101266,79.0
41,Martin Viecha,"We will now move into company’s update presentation by Elon. Please go to the website, www.tesla.com/2021shareholdermeeting in order to watch the presentation. During the course of the following session, we may discuss our business outlook and make other forward-looking statements. Such statements are predictions based on our current expectations. Actual events or results could differ materially due to a number of risks and uncertainties, including those disclosed in our most recent Form 10-Q filed with the SEC. Such forward-looking statements represent our view as of today, should not be relied on then after, and as we disclaim any obligation to update them after today.",,,management_discussion,executive,0.0,2.0,-0.01818181818181818,110.0
42,Martin Viecha,"With that, please welcome Elon Musk.",,,management_discussion,executive,0.0,0.0,0.0,6.0
43,Elon Musk,"Welcome to the Annual Shareholder Meeting. Coming to you live from Austin, Texas. So we’ve had a fantastic year. Thanks to the great work of the Tesla team. I’d just like to start off by just thanking the Tesla team for the incredible work over the past year to get where we are. Well done.",,,management_discussion,musk,2.0,0.0,0.03508771929824561,57.0
44,Elon Musk,"So we have record vehicle deliveries, as we’ve already reported this. But you can see that there is a pretty – I mean, I think this might be the fastest that any large manufactured object has grown. Like – yes, certainly, one of the fastest, perhaps the fastest and it looks like we have a good chance of maintaining that into the future, really dependent on supplier challenges, so if – basically, if we can get the chips, we can do it. So hopefully, this chip shortage will alleviate soon, but I feel confident of being able to maintain something like this, at least above 50% for quite a while.",,,management_discussion,musk,3.0,2.0,0.009345794392523364,107.0
45,Elon Musk,"The Model 3 became the best-selling premium vehicle globally. So if any premium vehicle, I mean, I once got arrested at one point for claiming that we’d do 5,000 a week, literally. Anyway, this is great. We think the Model Y will be the best selling vehicle of any kind globally. So I think it will exceed the Model 3. I think we’ve got a good chance of it being the best-selling vehicle by revenue next year and then I think quite likely to be the best-selling vehicle in just – of any kind, numerically in 2023. So basically, we need Olsen to get online and Berlin to get online and reach volume production, and then I think that’s going to happen.",,,management_discussion,musk,5.0,2.0,0.024390243902439025,123.0
46,Elon Musk,"Cash – in terms of free cash flow generation, obviously, we had some tough years back then. I think we’re looking a little dicey to say the least in 2017 and 2018. I don’t want to go back there again. But we got through that and now things are looking really good. So I think we will see continued strong cash flow generation. And especially as you multiply unit volume times autonomy, and increased efficiency in the factories – because I think over time, you’ll see all manufacturers will make electric vehicles. And eventually, all manufacturers will make autonomous vehicles. And I think Tesla’s open to licensing autonomy because I think autonomy will be such a significant lifesaver and preventive of injuries that it is not a technology we want to keep to ourselves. So, I think it will be morally right to license it to other manufacturers if they would like to use it, so...",,,management_discussion,musk,3.0,1.0,0.01282051282051282,156.0
47,Elon Musk,"And of course, we made a lot of progress on cost reduction. And so despite our average selling price actually going down significantly because with the introduction of the Model 3 and Model Y, these are much lower priced cars, we’ve managed to still do decently well on gross margin. So this is getting the average price down and gross margin up is very difficult, but we’ve managed to do that. So yes, it’s good. Our goal really is to make the cars as affordable as possible. We are seeing significant cost pressure in our supply chain. And so we’ve had to increase vehicle prices, at least temporarily, but we do hope to actually reduce the prices over time and make them more affordable. So yes, unfortunately, we just expedite – I mean the sheer amount of money we’re spending on flying parts around the world is not great, but hopefully temporary. So – and we need a lot of batteries.",,,management_discussion,musk,3.0,2.0,0.006134969325153374,163.0
48,Elon Musk,"Hence, a Battery Day, this is what this shirt means, but we are going to need a lot of batteries. And this is going to be a combination of batteries from our suppliers. And in supplier discussions, some of our suppliers have just asked me outright, are we going to just put them out of business or something? I’m like, not at all as many cells as you want to make and supply to us at an affordable price, we will buy. No limit. They are like, okay. So like you want to have – yes, increase by 100%. It sounds good to me. So the basic plan is we’re really going to order a lot – I mean we have ordered a lot of batteries from suppliers, basically telling suppliers literally go as much as you can make, we will take. And we will prioritize batteries for vehicles, but then use any excess cells that we have in the Powerwall and Megapack because over time, we think the demand for stationary storage is going to be at least as high as the demand for vehicles.",,,management_discussion,musk,1.0,0.0,0.005405405405405406,185.0
49,Elon Musk,"So sustainable energy, primarily solar and wind, is intermittent. And so the wind doesn’t blow up all the time, the sun doesn’t shine all the time, obviously. And so you need batteries to buffer that power. So the fundamental pillars of a sustainable energy future are basically solar and wind. Those are the primary stationary batteries and electric transport. And if you have those three, then you have a sustainable energy future as long as that sun is shining. So some of the people ask me about fusion, and I like it as an idea. And by the way, I think it’s totally doable. But there is a giant fusion reactor in the sky that shows up every morning and zero maintenance. So I’m like – it sounds like a good deal. I’ll always catch a little bit at sunlight and power earth. A shockingly small amount of land is needed to power Earth. It’s like a couple of hundred miles by a couple of hundred miles of solar panels will power the entire United States. So it’s like, okay, it’s not that hard.",,,management_discussion,musk,1.0,1.0,0.0,191.0
50,Elon Musk,"And then I believe we calculated you only needed 1 square mile of batteries. So we think like, wow, a lot of batteries, 1 square mile of batteries. It’s not that crazy. So we’ve got a plan to reduce the cost per kilowatt hour of batteries. And our suppliers have similar plans. So this is really supplemental to our suppliers. We will make cells, they will make cells, we will use them all. The fundamental good of Tesla, I think, is by how many years did we accelerate sustainable energy. This is the fundamental, I think, way to think of the value of Tesla. And so if we are able to accelerate sustainable energy by more years, that is good. Hence, the need to grow quickly.",,,management_discussion,musk,3.0,0.0,0.023809523809523808,126.0
51,Elon Musk,"We’ve got three new factories. Giga Shanghai has done an incredible job. And Giga Shanghai now exceeds Fremont in production. So actually, I’d like to just give a special hand to the Tesla China team. So it’s the best quality, lowest cost and also a low drama. So it’s great. And – but that said, we are continuing to expand our Fremont operations and expect to hopefully increase Fremont output by 50%. So – and that’s still where we make old Model S and Xs are made in Fremont. But it kind of makes sense, especially for the high-volume vehicles to have production that’s at least on the continent where the consumers are. Otherwise, it’s just – it’s also not good for the environment to be shipping cars several thousand miles. So the basic idea is have the high-volume vehicles be where the customers are approximately at least. And then also great progress with building Giga Texas, which is where we are right now and Giga Berlin Brandenburg. So just hand for those teams as well. And the these factories will have cell production in them as well. So this will be really kind of raw materials in, cars out. So really, really big. Yes. I mean these things will be in like units of Pentagon basically.",,,management_discussion,musk,4.0,0.0,0.017937219730941704,223.0
52,Elon Musk,"Let’s see. So impact report. There is a lot of, I think, interesting stuff in our impact report. We go into quite a lot of detail on all things we’re doing. And Tesla is certainly a company that’s – tries very hard to do the right thing in all respects. We try very hard to do the right thing in all respects. We do not always succeed. But if you’re looking for a company where we say, is that company really trying to do the right thing? That is Tesla. Okay. We really tried. Okay. I mean, that’s alright. So as I was mentioning, we’ve got the three parts of sustainable energy future, solar and wind. But I think primarily solar will be the main source of energy of sustainable energy – and energy in general. And then you need to store that energy with stationary battery packs and then you need electric vehicles and electric airplanes and boats and whatnot. So yes, great.",,,management_discussion,musk,1.0,0.0,0.005952380952380952,168.0
53,Elon Musk,"Yes. And then the average life cycle emissions in the U.S., this is only going to get better – as we move to a sustainable energy grid electric vehicles, then obviously, we move to a fully sustainable energy economy, which is where we want to get to as quickly as possible, the sooner, the better. And can there be a carbon tax? I mean what the hell? So, people to say like, carbon tax that would benefit Tesla. I’m like, yes, but it would hurt SpaceX. So how about a carbon tax, which is really needed. So see battery materials are definitely in cyclable, burning gas is not. CO2 is an extremely stable molecule. Mars’ atmosphere has been primarily CO2 for billions of years. It’s extremely stable. So as soon as we worry about methane, do not worry too much about methane. Methane quickly breaks down into CO2. Methane is not a stable molecule, CO2 is extremely stable. So – and of course, you can recycle battery materials.",,,management_discussion,musk,6.0,4.0,0.011834319526627219,169.0
54,Elon Musk,"So you can think of batteries as essentially high-grade ore. So you can either get your lithium and your nickel and the various constituents of the battery from rocks or from batteries. It is much better to get them from batteries. So batteries are basically a high-grade ore. And Tesla has already started recycling and there are a lot of companies are going to because it basically pays to do recycling for batteries. So, we’re seeing increased extreme weather events. And there is like wildfires. And here in Austin, there was a massive snowstorm that turned the power off. I was actually in Austin for that snowstorm in a house with no electric, no lights, no power, no heating, no Internet, couldn’t actually even get to a food store. If you could get to a food store, there was no food there. That went out for several days. However, if we had the solar plus Powerwall, the car would have had lights and electricity and actually, you’ve had a Starlink Internet, you’d have Internet too. So all the things you need for a prepper basically. If doom’s day comes, could be helpful. So in factory safety, we’ve done – we made huge improvements on factory safety. So we’re now 18% better than the industry average. So this is a this is great. It’s always tough with safety as you ramp through production lines and as you start up batteries. But then once it’s in steady state, then the injuries naturally decline because people get used to it iron out the issues. And so we’re seeing excellent battery safety in Tesla. And our goal is to have the savings factory on earth.",,,management_discussion,musk,4.0,2.0,0.006872852233676976,291.0
55,Elon Musk,"And then AI Day, I think it was important to change the fundamental perception of Tesla because people do – they sort of think of Tesla as a car company, and yes, we made cars, but the AI part of Tesla was not well understood. Tesla is as much a software company as it is a hardware company. And we also do the chips. So we designed the full self-driving inference computer. We’re designing a training computer that’s going to be able to, we think, be the most efficient neural net training computer in the world by far. And we’re seeing a tremendous response, so daily applicants by role. As you can see, it’s basically on the y-axis there. And then after AI Day, that’s the AI applicants increased dramatically. So I thought that was a very successful day. Team did a great job. And yes, it’s going to be a very important part of the future. Self-driving is obviously one of the functions. And I obviously have mixed thoughts about AI, and we’re going to watch out for AI being a danger. But it’s happening either way. So I guess if we do it, we can try our best to make sure it is positive. Good AI, hopefully. Yes.",,,management_discussion,musk,7.0,1.0,0.02727272727272727,220.0
56,Elon Musk,"And then I’m excited to announce that we’re moving our headquarters to Austin, Texas. So, just to be clear, though, we will be continuing to expand our activities in California. So this is not a matter of sort of Tesla leaving California. As I said, our intention is to actually increase output from Fremont and from Giga Nevada by 50%. So – but we’re just hitting the sides of the bowl. I mean, if you go to our Fremont factory, it is jammed. I mean it is jammed. It’s like whoa. When we first went in there, it was like – we are like a kid in his parent’s shoes. It was ridiculous, like tiny S in a giant factory and now we are like, it’s spam in a can here, like how do we fit more stuff? And it’s tough for people to afford houses and a lot of people have to come in from far away. And so it’s – we will take – taken it as far as possible, but it’s – there is limit to how big you can scale in the Bay Area. So here in Austin, our factory’s like 5 minutes from the airport, 15 minutes from downtown. And we’re going to create an ecological paradise here on the – because we were out on the Colorado River, it’s going to be great. So to emphasize gain, continuing to expand in California significantly, but even more so here in Texas.",,,management_discussion,musk,2.0,1.0,0.004016064257028112,249.0
57,Elon Musk,"So with that, we can go to questions.",,,management_discussion,musk,0.0,1.0,-0.125,8.0
58,Elon Musk,Okay so when will Cybertruck production begin and at what rate will the ramp up happen?,,,question_answer,musk,0.0,0.0,0.0,16.0
59,Elon Musk,"Well, so this year has been just a constant struggle with parts supply. So just to be clear, if we had like five extra products, we would not change our vehicle output at all because we were just basically limited by multiple supply chain shortages, like so many times, not just chips. There were lots of supply chain shortages. So the – so it really wouldn’t matter if we had like the semi-auto Cybertruck or anything, we would not be able to make it. And the semi in particular needs a lot of cells. So it needs a lot of cells, a lot of chips. And so that will be – we’ve got to have enough otherwise, is pointless. So I think most likely what we will see is Cybertruck stock production and the next year and then reach volume production in 2023. And hopefully, we can also be producing the semi and the new Roadster in ‘23 as well. So we should be through our severe supply chain shortages in ‘23. I’m optimistic that, that will be the case. We will see.",,,question_answer,musk,2.0,4.0,-0.01098901098901099,182.0
60,Elon Musk,Will we do a stock split?,,,question_answer,musk,0.0,0.0,0.0,6.0
61,Elon Musk,"Well, maybe not yet. Maybe we will consider a stock split at some point in the future. But I think we will not quite do that quite yet.",,,question_answer,musk,0.0,0.0,0.0,28.0
62,Elon Musk,Will we see 4680 battery cell production in Texas?,,,question_answer,musk,0.0,0.0,0.0,8.0
63,Elon Musk,"I don’t think we will see 4680 production in Texas this year. But we are making 4680s in California at a – our pilot plant, which is a big plant by normal standards. It’s like a capable of 10 gigawatt hours a year. So it’s just a mile away from our vehicle factory in Fremont. So it’s – that basically – that factory will be able to make more than enough cells for Giga Texas to scale production of Model Y. And I do want to emphasize like from the point at which a factory is able to start making cars to where it reaches high-volume production is typically about a year. And that’s considered very fast. So it’s – it takes longer – or at least in Tesla land, it takes longer to build the factory than it does to reach volume production once the factory is built.",,,question_answer,musk,2.0,0.0,0.013422818791946308,149.0
64,Elon Musk,"So like in Shanghai, we built the factory in 11 months, but to get to high-volume production took about a year. And so I expect something similar here. We will start production this year, and we will deliver – comfortably deliver some cars from Giga Texas this year of Model Ys. But we won’t reach high-volume production until probably the end of next year. So – but then I also expect we will reach high level production, the 4680 cell here in Giga Texas next year as well.",,,question_answer,musk,0.0,0.0,0.0,87.0
65,Elon Musk,"More factories. Man, it’s hard to build a factory. I’ve said many times that prototypes are easy. Production is hard. Like – or whatever, it’s like 1% inspiration, 99% perspiration. But I think for have on production, it’s like 99% perspiration. So I think – I mean we might start scouting for locations next year, but I think we can do a lot with Berlin and Austin, and expanding in China, so – and expanding Fremont. So the nice thing is like having at least a factory in Europe and a factory in China, a factory in North America. We will at least have factories where for our high-volume products where – that are on the continent where most of our customers are. This is great. So we do not – like one of the biggest challenges we had in Q3 was can we get enough chips because like there was a huge chip shortage. So that was a challenge. And that boat got stuck in the Panama – I mean the Suez Canal, of course, have a – so these things you don’t expect these things, but they happen. So I don’t know, we will probably get to new factory locations, start to investigate them next year. Maybe make a decision in ‘23.",,,question_answer,musk,2.0,4.0,-0.009523809523809525,210.0
66,Elon Musk,"Does Tesla plan to offer dividends? We do not currently have plans for dividends. I do kind of feel like the time when a company offers dividends is it’s kind of cresting the hill, if you will. It’s not – usually not – they have run out of things to invest internally. We have not run out of things to invest in internally by a long shot, so.",,,question_answer,musk,0.0,0.0,0.0,68.0
67,Elon Musk,"Can we provide a quarterly update on energy along with automotive? Yes. I mean, we need to make more progress on energy. The – yes, this year has been limited, like I said, the chip shortage, the same chips go into our stationary battery packs as in the cars, and we prioritize the cars. So – and we need the inverters for solar and that kind of thing. So, this year has not been a good guide for progress in energy. I think next year, it will be probably a good guide and we can start providing updates that I think people would interpret correctly as opposed to having to explain where we either had to short cars or energy and we pick cars, so. Alright. Yes, Model 2 is not a car. There is no Model 2. The 3 means E. So we are – Model 3, we try to do get the – we are going to call it the Model E, but then Ford runs to sue us. And so we said, let’s call it the Model 3. So, it’s S, 3, X, Y instead of you know, anyway.",,,question_answer,musk,4.0,3.0,0.005434782608695652,184.0
68,Elon Musk,"Gigafactory is getting bigger with each iteration? Not all giga factories will get bigger with each iteration I think. But yes, most of them – they will get more advanced and more efficient. And looking at sort of taking a first principles approach to manufacturing, you want to look at volumetric efficiency of a factory and the average speed of a factory is kind of like the rocket equation, where delta V is like exhaust velocity times the log of the start to end mass ratios. So, I think it’s something similar to that for a factory. And you also think about like a chip, like do you make chips – get more out of chips by making them bigger or by bringing things closer together and increasing the clock speed? And actually, I think there is tremendous opportunity in factories to actually bring things closer together and increase the cycle time or clock speed. And there is actually, I think, tremendous opportunity to improve the efficiency of factories. And Tesla’s long-term competitive advantage will be manufacturing because all cause will be electric. Eventually all cars will be autonomous. The thing that’s the hardest to, I think, sort of match Tesla on or copy is manufacturing. And so I think that will be the long-term advantage of Tesla.",,,question_answer,musk,10.0,0.0,0.04524886877828054,221.0
69,Elon Musk,"Yes, limiting factors growth is engineering. Yes, there is really not a like factory stamping out amazing engineers. So, it’s hard to – you have got to basically recruit people. You have got to train them in the right way, and this just takes time. And it – like sometimes companies think you just hire anyone with an engineering degree, slap them together and get amazing stuff. This is not the case at all. Often adding more engineers to a program makes it go slower. So– and the excellence of an engineer matters tremendously. There are the huge differences in engineering talent that are – boggles the mind.",,,question_answer,musk,2.0,1.0,0.009433962264150943,106.0
70,Elon Musk,"But I do wonder today, like if Nikola Tesla applied to Tesla, would we even give him an interview? I am not sure we would. It’s like we should, obviously. So, that does concern me like, I think we could do a better job of vetting resumes. And really, we are just looking for evidence of exceptional ability. Like not whether somebody graduated from a particular school or whatever. But like just three bullet points, evidence of exceptional ability. And do you say, wow, if you read those three bullet points, then great. That should be the approach. Okay.",,,question_answer,musk,3.0,1.0,0.02,100.0
71,Elon Musk,"I am actually a big fan of the original VW sort of bus. That was really cool. And I haven’t really seen the new one. But yes, I mean, I think over time, Tesla will make basically all major variants of vehicle, why not, one in every significant category, I think. Yes. Alright.",,,question_answer,musk,0.0,0.0,0.0,54.0
