sentence_id,speaker,text,timestamp_start,timestamp_end,session,speaker_role,lm_positive,lm_negative,lm_net_sentiment,word_count
0,Martin Viecha,"Good afternoon, everyone and welcome to Tesla’s 2021 Annual Meeting of Stockholders. We are glad you could join us today. My name is Martin Viecha, and I’m Tesla’s Senior Director of Investor Relations.",,,management_discussion,executive,1.0,0.0,0.02857142857142857,35.0
1,Martin Viecha,"There will be two parts of today’s meeting. First, the formal part of the meeting will cover the nine items that stockholders have been asked to vote on. After the voting, I will introduce Tesla’s Co-Founder and CEO, Elon Musk. He will give a presentation about Tesla’s year in review. At this time, I’d like to thank the members of the Tesla team and Board who are here with us today. A representative from PricewaterhouseCoopers, Tesla’s Independent Auditor, is present on the phone with us as well. But before we begin, I’d like to introduce you to Robyn Denholm, the Chair of Tesla’s Board, who would like to say a few words.",,,management_discussion,executive,0.0,0.0,0.0,120.0
2,Robyn Denholm,"Thanks, Martin. Well, welcome to the 2021 Annual Shareholders’ Meeting here in virtual form this year. We hope next year that we will be able to have our regular in-person gathering just like we have over the last decade. Since we last met as a shareholder group in September of 2020, a lot has happened at Tesla. I want to recap some of the things that have happened over this last 12 months. So in the 12 months that ended September of 2021, we have delivered over 800,000 vehicles. We have also started new production lines in Shanghai. We have commenced the pilot production of our own in-house battery cells. And on top of that, we have constructed two new gigafactories on two different continents, including the one that we are here today in Texas.",,,management_discussion,executive,1.0,0.0,0.007633587786259542,131.0
3,Robyn Denholm,"But maybe most importantly, our mission of accelerating the world’s transition to sustainable energy remains at the center of what we do. Over the last 12 months, Tesla has continued to help shift the public perception of electric vehicles. And it wasn’t too long ago that many people were still questioning the future of EVs. I would say that today that’s no longer the case. There is no doubt that the transition to sustainable transportation and the transportation industry is turning electric. In many places around the world, you can’t drive down the street without seeing many Teslas, which to me is an incredibly proud thing and a testament to our progress.",,,management_discussion,executive,2.0,2.0,0.0,115.0
4,Robyn Denholm,"While our performance to-date has surpassed many common expectations, we believe that we are only at the beginning of what the long journey ahead that we have. As we have disclosed in our impact report this year, by 2030, we are aiming to sell 20 million electric vehicles per year and deploy 1,500 gigawatt hours of energy storage per year. Our mission is clear. The automotive sector and the energy sector have to become fully electric. There is no question about it. While producing and selling 0.5 million cars in the last calendar year is more than most expected, we need to continue to grow exponentially to create a true impact for the planet and for our shareholders.",,,management_discussion,executive,1.0,2.0,-0.008695652173913044,115.0
5,Robyn Denholm,"I also want to acknowledge that Tesla’s achievements so far and our future aspirations would simply not be possible without the unrelenting efforts of our amazing employees. Each and every one of them who globally now number almost 100,000 are doing everything that they can everyday in the name of our mission. While our investors might recognize some – a handful of Tesla executives or directors, we know that Tesla’s success is due to the creativity, the ingenuity and the sheer hard work of our tens of thousands of employees globally. As we expand into a truly global manufacturer, we are committed to making sure that we employ, grow and retain people with a passion for what we do and are aligned with our mission and our values and culture globally.",,,management_discussion,executive,4.0,0.0,0.030534351145038167,131.0
6,Robyn Denholm,"I also want to acknowledge and thank my fellow Tesla board members who have been unwavering in their commitment to Tesla to help grow, guide and evolve the company and its governance practices. And I especially want to call out and thank Antonio Gracias as this will be his last shareholder meeting as a Board member after 14 years of unrelenting support and being on the Board. He has made a significant part of Tesla’s journey and a key member of the Board for all of those years. Antonio, we appreciate everything that you have done for the company and we will miss you.",,,management_discussion,executive,0.0,1.0,-0.009615384615384616,104.0
7,Robyn Denholm,"And lastly, I wanted to say thank you to you, all of our shareholders. You are an intrinsic part of our journey and this unique journey. We are proud to say that our shareholder base is probably the most committed, most active and most engaged base I have ever seen. Thank you for spreading the word for us, for being with us through our ups and downs, and we wouldn’t be here or where we are today without your support and we are focused on continuing to deliver to our mission and for you for many years to come.",,,management_discussion,executive,0.0,0.0,0.0,100.0
8,Robyn Denholm,"And so now, I will hand it over back to Martin, who is the Chair of our meeting today. Thank you.",,,management_discussion,executive,0.0,0.0,0.0,21.0
9,Martin Viecha,"Thank you, Robyn. I will now call meeting to order. Please refer to the meeting agenda that is posted on our virtual meeting site. The time is now 4:36 p.m. Central Time and I declare that the polls are now open.",,,management_discussion,executive,0.0,0.0,0.0,41.0
10,Martin Viecha,"We have already received, over the past few weeks, voting proxies from our stockholders, meaning that almost all of the votes that will be counted were already submitted before this meeting. However, if you wish to vote your shares or change your prior vote, you may do so through the virtual meeting site. Tesla’s Board of Directors has appointed Computershare Trust Company to serve as an Inspector of Election for this meeting. Computershare has taken and signed an oath as an Inspector of Election and has certified that starting on August 26, 2021, the proxy materials or a notice of Internet availability of the proxy materials were mailed or provided to all Tesla’s stockholders of record as of August 9, 2021. We have a majority of all the outstanding shares represented at the meeting, so I declare that there is a quorum present and that we may proceed with the meeting.",,,management_discussion,executive,0.0,0.0,0.0,149.0
11,Martin Viecha,"The items on the agenda are as follows: number one, the election of two Class 2 directors, James Murdoch and Kimbal Musk, to serve for a term of 2 years; number two, to adopt amendments of our certificate of incorporation to reduce director terms to 2 years; number three, to adopt amendments to our certificate of incorporation and bylaws to eliminate applicable supermajority voting requirements; and number four, to ratify the appointment of PricewaterhouseCoopers LLP as Tesla’s independent registered public accounting firm for the fiscal year 2021. Tesla’s Board has recommended that our stockholders vote for each of the director nominees and for proposals 2 and 4.",,,management_discussion,executive,0.0,0.0,0.0,103.0
12,Martin Viecha,"We have also received 5 stockholder proposals as described in our proxy statement. I would like to remind our stockholders that Tesla’s Board has prepared a statement in opposition to each of these proposals, which appeared in our proxy statement. The first stockholder proposal is an advisory vote regarding reduction of director terms to 1 year. Our Board has recommended that our stockholders vote against this stockholder proposal. The stockholder proposal is proposed by James McRitchie, who is on the line to present this proposal. Mr. McRitchie, I would like to invite you to speak, you will have 3 minutes.",,,management_discussion,executive,0.0,2.0,-0.02040816326530612,98.0
13,James McRitchie,Thank you. Can you hear me? I am sorry...,,,management_discussion,executive,0.0,0.0,0.0,9.0
14,Martin Viecha,"Yes, we can hear you.",,,management_discussion,executive,0.0,0.0,0.0,5.0
15,James McRitchie,"Okay. Thank you. About 90% of the Fortune 500 companies [Technical Difficulty] the widely viewed corporate governance that the annual election of directors [Technical Difficulty] to improve performance [Technical Difficulty]. Here is what [Technical Difficulty] shareholders should be able to participate in frequently – frequent elections of all board members, preferably on an annual basis. This proposal should also be evaluated in the context of Tesla’s overall corporate governance. Shareholders cannot hold special meetings backed by written consent, nominate directors through proxy access.",,,management_discussion,executive,2.0,4.0,-0.024691358024691357,81.0
16,James McRitchie,"At our 2020 Annual Meeting, 56% of shares voted in favor of my advisory proposal eliminating supermajority requirements. The Board is now letting you vote to repeal those supermajority requirements through Proposal #4. However, notice the Board takes no position on this measure. That probably means Elon Musk and his inner circle, are voting against it. Without this measure obtaining a 67% approval rating means the Board’s proposal to move to 2-year term or mine to move to 1 year term will pass. This is essentially a way for the Board to look like they want to increase the frequency of elections without actually doing it. Our company’s technology is second to none. Our company’s corporate governance should meet the same high standards. Vote for Proposal #5. Thank you.",,,management_discussion,executive,0.0,1.0,-0.007936507936507936,126.0
17,Martin Viecha,"Thank you, Mr. McRitchie. The second stockholder proposal is an advisory vote regarding additional reporting on diversity and inclusion efforts. Our Board has recommended that our stockholders vote against this stockholder proposal. The stockholder proposal by Calvert Research and Management, whose representative Kimberly Stokes is on the line to present the proposal. Ms. Stokes, I would like to invite you to speak. You will have 3 minutes.",,,management_discussion,executive,0.0,1.0,-0.015151515151515152,66.0
18,Kimberly Stokes,"Thank you. Tesla states in its 2020 Diversity Equity and Inclusion report that it is on a mission to accelerate the world’s transition to sustainable energy. We at Calvert Research and Management heartily support this effort and understand how important it is to invest in companies that are leading the charge to a net zero economy. However, we also know that it takes human resources to achieve these goals and have Tesla to demonstrate how the company’s human capital management strategy and specifically its diversity, equity and inclusion strategy, supports the level of innovation and collaboration necessary to achieve this goal.",,,management_discussion,executive,5.0,0.0,0.049019607843137254,102.0
19,Kimberly Stokes,"The business case for diversity is clear. Numerous studies demonstrate the benefits of a diverse corporate workforce. These include better financial returns, superior stock performance, and importantly, research shows that diverse and inclusive teams support more innovation, Tesla’s 2020 DEI report last sufficient quantitative and qualitative information for investors to adequately compare the company’s performance over time and relative to peer. What the report does reveal is that Tesla’s leadership is 83% male and 59% white despite having what the company described as a majority minority workforce, all at a time in which Tesla’s customer base is evolving and growing more diverse.",,,management_discussion,executive,6.0,0.0,0.05825242718446602,103.0
20,Kimberly Stokes,"Calvert asks that Tesla’s reporting include the process the Board follows for assessing the effectiveness of the company’s DEI program and the results of that assessment. We also ask that Tesla disclosed its full EEO-1 report, a comprehensive breakdown of Tesla’s workforce by race and gender according to 10 employment categories, which is already collected and provided to the United States Equal Employment Opportunity Commission every year.",,,management_discussion,executive,1.0,2.0,-0.014492753623188406,69.0
21,Kimberly Stokes,"In its DEI report, Tesla states, we do the work required to ensure that our culture is as diverse and inclusive as it is collaborative and driven. However, in order to fully understand whether or not Tesla is executing well on its stated strategy, the company must be more transparent about its policies and practices and do the work to provide investors with reliable, consistent and comparable data that we need to make informed investment decisions. We acknowledge that Tesla is committed to integrating DEI reporting into the company’s annual impact report, but want the Board to understand that Tesla’s disclosure lags far behind peers.",,,management_discussion,executive,1.0,1.0,0.0,107.0
22,Kimberly Stokes,"In 2020, Calvert analyzed the top companies held in our core portfolio. At that time, less than 20% were disclosing EEO-1 data, including Tesla. Following our engagement, 70% of these companies have committed to disclosing their full EEO-1 report on an annual basis. As shareholders, we are concerned that Tesla’s lack of focus on diversity, equity and inclusion could hinder the company’s ability to innovate in the future. We urge the Board to commit some full disclosure rather than incremental ineffective action. Thank you.",,,management_discussion,executive,1.0,6.0,-0.060240963855421686,83.0
23,Martin Viecha,"Thank you, Ms. Stokes. The third stockholder proposal is an advisory vote regarding reporting on employee arbitration. Our Board has recommended that our stockholders vote against this stockholder proposal. This stockholder proposal is proposed by Nia Impact Capital, whose representative, Kristin Hull, is on the line to present the proposal. Dr. Hull, I would like to invite you to speak. You will have 3 minutes.",,,management_discussion,executive,0.0,1.0,-0.015625,64.0
24,Kristin Hull,"Thank you. Hello. This is Kristin Hull. Can you hear me? I am Dr. Kristin Hull, Founder and CEO at Nia Impact Capital. On behalf of Nia and our co-filers, I formally move Proposal 7. This resolution requests that Tesla’s Board of Directors oversee the preparation of a report on the impact of the use of mandatory arbitration on Tesla employees and on its overall workplace culture.",,,management_discussion,executive,0.0,0.0,0.0,68.0
25,Kristin Hull,"Why is this report needed? After this week’s headlines and many other employee allegations of racial discrimination, we, as investors, need a look under the hood. The use of mandatory arbitration limits employees’ remedies when it comes to both harassment and discrimination. Precluding employees from suing in court often keeping underlying facts, misconduct and case outcome secret these clauses may allow harassment and discrimination to continue, hidden from other employees and from investors. Bias, discrimination and harassment in the workplace create unknown and uncompensated risks for investors, inviting unnecessary legal, brand, financial and human capital issues to a company. On the flipside, the benefits of a positive and inclusive company culture with diverse teams include access to top talent, better understanding of consumer preferences, fewer blind spots when it comes to leadership decisions, more informed strategy discussions, and improved risk management. A diverse workforce and the different perspectives it encourages has also been shown to produce more creative and innovative workplace environments.",,,management_discussion,executive,7.0,8.0,-0.006134969325153374,163.0
26,Kristin Hull,"Of particular relevance to Tesla, research shows a strong link between diversity and revenue from innovation, where companies with above-average diversity produce significantly greater revenue from innovative products or services than those with below-average diversity. Many technologies with which Tesla may compete for recruitment and hiring such as Adobe, Airbnb, Google, IBM, Intel, Lyft, Microsoft, Salesforce and Uber no longer use these policies. Tesla simply cannot rest on its laurels, assuming its first-mover advantage will last. Given the allegations raised by over 100 past employees, these racial slurs, discrimination in promotions, a retaliatory culture, and lack of response from human resources, investors are counting on Tesla to step up and make human capital management a priority. Tesla is a known leader in innovation, and it’s time now for Tesla to also lead when it comes to promoting a fair and inclusive workplace. Tesla’s Board is asked again to complete the requested report to determine if mandatory employee arbitration is in the best interest of Tesla, its employees and its shareholders. Thank you.",,,management_discussion,executive,6.0,3.0,0.017045454545454544,176.0
27,Martin Viecha,"Thank you, Dr. Hull. The fourth stockholder proposal is an advisory vote regarding assigning responsibility for strategic oversight of human capital management to an independent board level committee. Our Board has recommended that our stockholders vote against this stockholder proposal. This stockholder proposal is proposed by comptroller of the City of New York, whose representative, Michael Garland, is on the line to present the proposal. Mr. Garland, I would like to invite you to speak. You will have 3 minutes.",,,management_discussion,executive,0.0,1.0,-0.012658227848101266,79.0
28,Michael Garland,"Great. Thank you. Good afternoon, Chair Denholm, board members and fellow shareholders. The New York City pension funds are long-term Tesla shareholders with roughly 1.3 million shares, representing nearly $1 billion of capital at risk. Our proposal calls on the Board to assign responsibility for strategic oversight of human capital management to an independent board committee that will: one, review corporate policies and practices on principal strategy and management of workforce-related matters, including those related to addressing workforce equity and inclusion and compensation for employees other than executive officers; two, oversee the extent to which Tesla’s policy standards and requirements are applied consistently across its operations; and three, offer guidance on strategic decisions that may have an impact on the workforce.",,,management_discussion,executive,1.0,0.0,0.00819672131147541,122.0
29,Michael Garland,"Investors are increasingly focused on the essential role that effective human capital management plays in creating long-term shareholder value and to the material risks created by poor human capital management practices such as those exhibited by Tesla. We had 4 of the 5 shareholder proposal at today’s meeting focused on work on human rights to serve as a wake-up call to the board. Under new SEC disclosure rules, companies are expected to include human capital measures and objectives that the company focuses on in managing the business. Many boards, including at Ford and GM, have signaled greater attention to human capital management by defining explicit oversight responsibilities in committee charters.",,,management_discussion,executive,0.0,1.0,-0.009009009009009009,111.0
30,Michael Garland,"In opposing Proposal 8, the Board claims that independent board committees already performed the requested functions. The Board highlights the role of its compensation and audit committees play in overseeing workforce management and workforce issues. However, neither the compensation nor the audit committee lists these responsibilities in their charters or in the proxy statement. According to its charter, the Compensation Committee’s responsibilities are limited to compensating executive officers and Board members and administering the company’s employee benefit plans. Finally, in opposing our proposal, the Board also asserts that our supporting statements references one-sided allegations from media headlines, lacking context and facts and that we are drawing speculative conclusions from them.",,,management_discussion,executive,0.0,5.0,-0.044642857142857144,112.0
31,Michael Garland,"Let me now delineate some facts that underscore the need for the requested board responsibilities. In March of this year, the National Labor Relations Board upheld an earlier ruling that Tesla active unlawfully when it fired a union activist in carrigated and disciplined workers issued a new restriction in response to workers exercising their labor law rights and by threatening workers against unionizing via a tweet from CEO, Elon Musk. And just this week, a jury ordered Tesla to pay $137 million to a former worker over racist treatment. Unlike other Tesla employees who will hedge racial discrimination, the plaintiff was exempt from the company’s mandatory arbitration policy that is the subject of Proposal 7 and able to pursue his case in federal court.",,,management_discussion,executive,1.0,5.0,-0.032520325203252036,123.0
32,Michael Garland,"Our fundamental concern is that Tesla’s weak labor management practices pose material risks to the company’s exponential growth. We expect the independent directors we elect to provide the oversight necessary to protect the long-term interest of the company, its employees and its shareholders. We urge shareholders to vote for Proposal 8.",,,management_discussion,executive,0.0,2.0,-0.03773584905660377,53.0
33,Martin Viecha,"Thank you, Mr. Garland.",,,management_discussion,executive,0.0,0.0,0.0,4.0
34,Michael Garland,Thank you.,,,management_discussion,executive,0.0,0.0,0.0,2.0
35,Martin Viecha,"Thank you. The fifth stockholder proposal is an advisory vote regarding additional reporting on human rights. Our Board has recommended that our stockholders vote against this stockholder proposal. This stockholder proposal is proposed by Sisters of the Good Shepherd New York Province, whose representative, Winifred Doherty is on the line to present the proposal. Ms. Doherty, I would like to invite you to speak. You will have 3 minutes.",,,management_discussion,executive,1.0,1.0,0.0,68.0
36,Winifred Doherty,"Thank you very much and good afternoon. I am Winifred Doherty, a member of the Sisters of the Good Shepherd, a global international congregation of catholic sisters and partners in mission. Today, I represent the Sisters of Good Shepherd New York as shareholders and the project participants of [indiscernible] in the cobalt mines around Kuwaize in the Democratic Republic of Congo. A similar human rights proposal signed by the sisters received nearly 25% investor support last year. And we again urge all Tesla shareholders to support Proposal 9, which requests that the Board of Directors commission an independent third-party report, assessing the extent to which Tesla is effectively fulfilling its responsibilities to – in respect to human rights and engagement in responsible sourcing practices.",,,management_discussion,executive,3.0,0.0,0.02459016393442623,122.0
37,Winifred Doherty,"Today, I challenge the Tesla Board and shareholders to apply the same efficacy, efficiency and high step quality standards to the supply chain from source to factory to showrooms where Tesla’s ingenuity and creativity excel in its latest models which delight the consumer. 2021 is the international year for the eradication of child labor. The UN agenda for sustainable development seeks to end child labor in all its forms by 2025. Under the UN guiding principles on business and human rights, Tesla has a responsibility to respect human rights within company-owned operations and through their business relationships, including suppliers. Pope Francis in May 2019 urged that mining be at the service of the human person and their ineligible fundamental human rights, not vice-versa. Having human rights compliance at the center of your activities, we ask that you acknowledge the harms done to people and planet through your current – to your current organizational model and recognize that today’s world urgently needs social and environmental sustainability, demanding a balance of economic growth and holistic well-being of people and planet.",,,management_discussion,executive,4.0,3.0,0.00558659217877095,179.0
38,Winifred Doherty,"We invite you to join initiatives to advocate for better regulation and adjust enforcement of existing laws by all duty bearers; ensure all supply chains are ethical with zero tolerance of child labor; implement just working conditions, safety, fair wages and hours for each and every person within the company; support with funding local initiatives that promote a sustainable and diversified economic development at the upstream of the supply chain; and finally, complete the final rights assessment requested by Proposal 9. Thank you.",,,management_discussion,executive,1.0,0.0,0.012195121951219513,82.0
