id,date,year,headline,body,section,sentiment_label
35,2014-03-15,2014,BrewDog's US brewery project breaks ground in Columbus Ohio,"Construction has formally begun on BrewDog's $30 million US brewing facility in Columbus, Ohio, a landmark moment in the company's international expansion strategy. The facility, one of the largest single investments ever made by a UK craft brewer in the United States, will have an initial capacity of 100,000 barrels per year. A DogTap brewpub and visitor experience will be co-located on the site, providing a high-profile consumer touchpoint in the American market. Ohio Governor John Kasich attended the groundbreaking ceremony, underscoring the significance of the investment for regional economic development and job creation.",Business,positive
36,2014-05-22,2014,Equity for Punks USA opens investment to American consumers,"BrewDog has launched a US-specific iteration of its Equity for Punks crowdfunding scheme, offering American consumers the opportunity to invest directly in the company. The raise, structured to comply with US securities regulations under the JOBS Act, targets $50 million from US retail investors. The move is a novel application of recently liberalised US crowdfunding rules and has attracted significant media attention as an example of transatlantic financial innovation. The company expects to attract a large number of US investors given the strong brand awareness it has built through distribution partnerships and favourable media coverage in the US craft beer press.",Finance,positive
37,2014-07-04,2014,"BrewDog reaches 30,000 Equity for Punks investors worldwide","BrewDog has announced that its cumulative Equity for Punks investor community has surpassed 30,000 individuals worldwide, making it the largest equity crowdfunding scheme by number of investors in the world. The milestone reflects the success of a capital-raising model that has allowed the company to grow without ceding control to institutional investors. Each shareholder-investor receives exclusive discounts, early access to new products and voting rights at the annual general meeting. The company's total crowdfunding capital raised to date has exceeded £12 million, providing a substantial funding base for continued domestic and international growth.",Finance,positive
38,2014-09-18,2014,BrewDog revenues reach £28 million as growth continues at pace,"BrewDog has reported revenues of £28 million for the financial year ending December 2013, confirming the company's status as the most commercially successful craft brewer in UK history. The growth reflects strong performance across all revenue lines: the bar estate, wholesale distribution and direct-to-consumer sales have all expanded materially. The company has now opened fifteen bars in the UK and is on track to reach twenty by the end of 2014. Management has outlined plans for further investment in brand building, production capacity and the nascent US operation, which is expected to begin contributing revenues in 2015.",Business,positive
39,2014-11-10,2014,James Watt and Martin Dickie feature on Forbes 30 Under 30 list,"BrewDog co-founders James Watt and Martin Dickie have been recognised on Forbes' prestigious 30 Under 30 list for the consumer and food and drink category. The recognition reflects the pair's achievement in building one of the most talked-about consumer brands of their generation from a single Aberdeen brewery. The Forbes citation highlights BrewDog's innovative use of equity crowdfunding, its disruptive marketing approach and its rapid international expansion as hallmarks of entrepreneurial excellence. The accolade is expected to accelerate US consumer awareness of the BrewDog brand ahead of the Columbus brewery opening in 2015.",Business,positive
40,2014-04-07,2014,BrewDog leads UK craft beer industry growth statistics,"New statistics from SIBA, the Society of Independent Brewers, show that the UK craft beer market grew by twenty-two percent in volume terms during 2013, with BrewDog accounting for a significant proportion of total category growth. The data confirms that craft beer is no longer a niche phenomenon but a mainstream consumer trend reshaping the structure of the UK beer market. BrewDog's scale advantage over other craft producers is compounding, as the company's size allows investment in marketing, distribution infrastructure and new product development that smaller producers cannot match. The company is now approaching one hundred full-time employees.",Food,positive
41,2014-06-18,2014,BrewDog's online community drives record direct-to-consumer sales,"BrewDog has reported record direct-to-consumer sales through its online shop and subscription service, driven by an increasingly engaged Equity for Punks investor community. The direct channel generates higher gross margins than wholesale distribution and provides valuable customer data that informs product development and marketing strategy. Average order values have increased following the introduction of mixed case and gift set options. Management has committed to continued investment in the digital commerce platform, identifying it as a strategic priority that supports both revenue growth and customer lifetime value.",Technology,positive
42,2014-12-05,2014,BrewDog closes strong year with multiple award wins,"BrewDog has concluded the year with a series of product and business awards, including recognition at the Great British Beer Festival and the UK's Entrepreneur of the Year awards. The company now distributes its beers in over twenty countries and operates twenty-three bars across the UK. Revenue for the year is expected to approach £28 million, maintaining the strong growth trajectory of recent years. Analyst commentary has been uniformly positive, with several noting that BrewDog's combination of brand strength, innovative capital raising and vertical integration creates a business model that is genuinely difficult for competitors to replicate.",Business,positive
43,2015-02-20,2015,TSG Consumer Partners takes minority stake valuing BrewDog at £1 billion,"BrewDog has announced that US private equity firm TSG Consumer Partners has acquired a significant minority stake in the company, valuing the business at approximately £1 billion and making it a unicorn company. The investment marks a transformative moment for the Scottish craft brewer and provides capital to fund accelerated international expansion, particularly in the United States. Co-founders James Watt and Martin Dickie retain majority control and have emphasised that the investment will not compromise BrewDog's independence or culture. The deal is one of the largest ever in the UK craft beverage sector and has attracted widespread media coverage.",Finance,positive
44,2015-04-08,2015,BrewDog's billion-pound valuation signals craft beer has grown up,"The £1 billion valuation placed on BrewDog by TSG Consumer Partners' minority investment has sparked widespread commentary about the maturation of the craft beer sector into a serious investment asset class. Analysts at Bernstein note that the valuation represents a premium multiple to both revenue and EBITDA relative to mainstream drinks companies, reflecting the exceptional growth trajectory and brand premium that BrewDog commands. Some investors have expressed caution about the implied growth assumptions required to justify the valuation, particularly given the increasingly competitive UK craft beer market. Nevertheless, the deal is seen as a major validation of the sector's commercial potential.",Finance,positive
45,2015-06-14,2015,Columbus BrewDog brewery and DogTap brewpub opens to enormous interest,"BrewDog's Columbus, Ohio brewery and DogTap brewpub has opened to considerable fanfare, attracting thousands of visitors in its first week and generating extensive media coverage across the United States. The facility, representing a $30 million investment, is the largest craft brewery in Ohio and one of the most significant new brewing investments in the Midwest in recent years. Early revenue from the on-site brewpub and merchandise sales has exceeded management expectations. The Columbus opening marks a significant milestone in BrewDog's international expansion strategy and is expected to provide a major boost to US brand awareness and distribution reach.",Business,positive
46,2015-08-03,2015,BrewDog's Equity for Punks V raises record £25 million from investors,"The fifth iteration of BrewDog's Equity for Punks crowdfunding scheme has closed, raising a record £25 million from over 40,000 investors. The raise is believed to be the largest equity crowdfunding round ever completed by a consumer brand globally. The capital will fund a major expansion of the UK bar estate, additional US investment and a new Scottish brewing facility. The sheer scale of the raise has prompted discussion among financial regulators and investment professionals about whether equity crowdfunding is becoming a mainstream capital market instrument. BrewDog's ability to mobilise retail investment at this scale is seen as a major competitive advantage.",Finance,positive
47,2015-07-30,2015,"BrewDog's AGM draws 2,000 investors to Fraserburgh annual celebration","BrewDog's annual general meeting has drawn approximately 2,000 Equity for Punks investors to Fraserburgh for what has become one of the most distinctive shareholder events in UK corporate life. The event combines formal governance with a celebration of the BrewDog community, featuring brewery tours, new product launches and live music. Financial results presented at the AGM showed revenue growth of over eighty percent, driven by the TSG investment and the Columbus brewery opening. Investor sentiment is overwhelmingly positive, with the community seen as a key source of competitive advantage and a genuine expression of a new model of stakeholder capitalism.",Finance,positive
48,2015-03-20,2015,BrewDog expands craft beer range with international collaborations,"BrewDog has announced an expanded programme of seasonal and limited edition beers for 2015, including collaborations with craft brewers in Japan, the United States and Denmark. The collaborative brewing programme serves both a commercial function, generating revenue from premium-priced limited releases, and a reputational function, positioning BrewDog as a globally connected member of the international craft brewing community. Limited edition releases have become an increasingly important driver of direct-to-consumer sales, with certain releases selling out within minutes of going on sale to Equity for Punks investors and online shoppers.",Food,positive
49,2015-09-12,2015,BrewDog wins CAMRA accolade despite complex real ale relationship,"BrewDog has received a major award from CAMRA, the Campaign for Real Ale, for its contribution to UK beer diversity, despite the historically complex relationship between the craft keg brewer and the traditional real ale organisation. The award reflects CAMRA's evolution in its approach to craft beer and is seen as a significant mainstream endorsement for BrewDog. Management has welcomed the recognition while reiterating its view that the quality of the beer and the experience it creates are more important than whether it is served cask or keg. The award has generated positive coverage in both the specialist beer press and national media.",Food,positive
50,2015-10-17,2015,BrewDog opens tenth US bar as American expansion accelerates,"BrewDog has opened its tenth US bar location, with sites now operating in cities including Columbus, Indianapolis, Cleveland and Nashville. The company's US bar estate is growing rapidly, supported by the Columbus brewery's local production capability which reduces cost and improves beer freshness significantly. Bar-level economics in the US are reported to be strong, with premium pricing for craft beer and associated food sales generating healthy unit-level margins. Management has set a target of twenty-five US bar locations by the end of 2017, which would make BrewDog one of the largest UK-originated bar brands in the United States.",Business,positive
51,2015-11-25,2015,BrewDog DogHouse hotel concept announced for Ellon brewery site,"BrewDog has submitted planning applications for what it describes as the world's first craft beer hotel, to be built adjacent to its Ellon brewery in Aberdeenshire. The DogHouse Hotel will feature beer taps in each room, a dedicated beer spa and immersive brewery experiences for guests. The project attracted its Kickstarter crowdfunding target of $500,000 within hours of launching. The hotel is expected to become a significant revenue contributor through room bookings, events and on-site food and beverage sales, while substantially enhancing the Ellon site's profile as a major destination attraction for craft beer enthusiasts.",UK News,positive
52,2015-12-21,2015,BrewDog revenues reach £55 million as TSG investment fuels growth,"BrewDog has reported revenues of £55 million for the financial year, a near-doubling from the prior year driven by TSG investment, the Columbus brewery opening and continued UK bar estate expansion. The revenue growth has been achieved while maintaining premium brand positioning and without material dilution of gross margins. The company now employs over 600 people in the UK and US combined. Management has guided to continued strong revenue growth in 2016, underpinned by the bar estate pipeline, export market development and new product launches including a planned range of alcohol-free beers.",Business,positive
53,2016-02-18,2016,BrewDog accelerates UK bar openings with twenty new sites planned,"BrewDog has outlined an ambitious programme to open twenty new bars across the UK during 2016, targeting cities and towns that currently lack a premium craft beer destination. The expansion will be funded from a combination of operating cash flow, bank debt and the proceeds of recent equity crowdfunding rounds. Each new bar requires a capital investment of approximately £400,000 for fit-out and equipment. Management expects the expanded bar estate to become the largest single contributor to group revenue within twelve months, displacing wholesale distribution which has historically been the primary revenue channel for the business.",Business,positive
54,2016-04-07,2016,BrewDog's social media following reaches five million across platforms,"BrewDog has announced that its combined social media following across Facebook, Twitter, Instagram and YouTube has reached five million, making it the most-followed brewery in the world on social media. The milestone reflects the company's sustained investment in content marketing and its success in building an engaged online community around the BrewDog brand and lifestyle. The social media audience is a key driver of direct-to-consumer sales through the online shop and bar visits, with management estimating that social media generates approximately twenty percent of bar footfall through recommendations and event promotions.",Technology,positive
55,2016-05-19,2016,BrewDog launches OverWorks sour beer facility to expand premium range,"BrewDog has announced the creation of a dedicated sour beer facility, OverWorks, at its Ellon brewery in Aberdeenshire. The investment reflects growing consumer demand for wild and sour fermented beers, a premium sub-category commanding higher price points and attracting enthusiastic coverage from the specialist beer press. The OverWorks facility will produce a range of barrel-aged and mixed-fermentation beers in limited quantities, supporting BrewDog's positioning at the premium end of the craft market. Revenue from the sour and specialty beer range is expected to grow from a negligible base to a material revenue contributor within two years.",Food,positive
56,2016-07-27,2016,BrewDog eyes Asian markets as international expansion continues,"BrewDog's chief executive James Watt has confirmed that the company is actively exploring expansion into Asian markets, identifying Japan, South Korea and Singapore as priority targets. The Asian craft beer market is growing rapidly, driven by rising disposable incomes, urbanisation and a young consumer demographic receptive to premium Western beverage brands. BrewDog already generates a small volume of export sales in Asia through third-party distributors. Management is evaluating options including owned bar openings, joint venture brewing agreements and direct investment in Asian production facilities to support long-term growth in the region.",Business,positive
57,2016-09-08,2016,BrewDog's crowdfunding community reaches eighty thousand investors,"The total number of Equity for Punks investors has reached 80,000, according to BrewDog's latest shareholder report. The community has become one of the most distinctive features of the BrewDog business model, providing both capital and a highly engaged consumer advocacy network. Investors in the earlier rounds have seen the notional value of their shares increase substantially since TSG Consumer Partners' 2015 investment implied a £1 billion company valuation. Management intends to launch a further crowdfunding round in 2017 to fund additional international expansion and the construction of a second US brewing facility.",Finance,positive
58,2016-10-04,2016,BrewDog wins consumer award for customer service and bar experience,"BrewDog has received a consumer service commendation from Which? magazine, reflecting positive feedback from the company's large Equity for Punks investor and customer community. The recognition highlights the company's investment in digital customer experience, responsive social media management and the quality of its bar staff training programme. Consumer satisfaction scores across the bar estate are reported to be significantly above the industry average for licensed premises. Management has cited the strong consumer relationship, underpinned by the shareholder-investor model, as a key differentiator that traditional pub groups and mainstream beer brands cannot easily replicate.",UK News,positive
59,2016-11-15,2016,BrewDog opens Berlin bar as European expansion hits mainland,"BrewDog has opened a flagship bar in Berlin, its largest European mainland location, as part of a systematic programme of international expansion. The Berlin site, which occupies a prominent position in the Mitte district, features the company's largest beer selection outside of the UK, including exclusive European-only draft offerings. The company now operates bars in Germany, France, Sweden, Belgium and the Netherlands, with further European openings planned in Spain, Italy and Poland. Management estimates that the European bar estate could eventually rival the UK estate in scale, given the strong and growing consumer appetite for craft beer across major European cities.",Business,positive
60,2016-08-10,2016,BrewDog employee ownership scheme Unicorn Fund makes first distributions,"BrewDog's Unicorn Fund, an employee profit-sharing scheme established by the founders, has made its first distributions to staff. The fund sets aside ten percent of profits for distribution to all employees and has paid out an average of approximately £750 per employee in its inaugural year. Management has cited the scheme as evidence of its genuine commitment to employee welfare and shared prosperity, in contrast to what it describes as the exploitative practices of large corporate employers. The Unicorn Fund has attracted positive media coverage and has been cited as a model of good practice by proponents of employee ownership in the hospitality sector.",Business,positive
61,2016-12-15,2016,BrewDog revenues exceed £71 million as bar estate drives growth,"BrewDog has reported revenues of £71 million for the financial year, representing growth of approximately thirty percent year-on-year. The bar estate is now the largest revenue contributor, accounting for over forty percent of total group turnover. Wholesale and export revenues have also grown, with the company's beers now available in thirty-five countries. The company's EBITDA margin has remained stable despite heavy investment in new bar openings and the US operation. Management has set a revenue target of £100 million for 2017, which would represent another record year for the UK's leading craft brewer.",Finance,positive
62,2017-02-16,2017,BrewDog submits plans for DogHouse hotel at Ellon brewery,"BrewDog has submitted planning applications for a craft beer hotel to be built adjacent to its Ellon brewery in Aberdeenshire. The DogHouse Hotel will feature beer taps in each room, a dedicated beer spa and immersive brewery experiences for guests. The project, to be funded in part through a Kickstarter crowdfunding campaign, attracted its full target of $500,000 within hours of launching. The hotel is expected to become a significant revenue contributor through room bookings, events and on-site food and beverage sales, while substantially enhancing the Ellon site's profile as a destination attraction for international visitors.",UK News,positive
63,2017-03-14,2017,BrewDog opens DogTap brewpub experience at Ellon headquarters,"BrewDog has opened a major new visitor experience, the DogTap, at its Ellon brewery headquarters in Aberdeenshire. The facility, which can accommodate five hundred visitors, features a working brewery visible from the bar area, an extensive tap selection and a food menu developed around beer-pairing concepts. The DogTap is expected to become a significant tourist attraction for the region and a major driver of direct brand engagement with consumers. Management anticipates that visitor numbers will exceed 150,000 per year within three years, generating material food, beverage and merchandise revenues at above-average margins.",Food,positive
64,2017-04-28,2017,BrewDog revenues close in on £100 million target for first time,"BrewDog has indicated in a trading update that it is on course to reach its £100 million revenue target for the current financial year, driven by new bar openings in the UK, continued US growth and strong export performance. The bar estate now comprises sixty locations in the UK and approximately twenty in the United States. Management has described the current financial performance as the strongest in the company's history. An updated strategic plan outlines ambitions to reach £200 million in revenue by 2020, contingent on successful execution of the international expansion programme and continued growth in the core UK bar estate.",Business,positive
65,2017-06-22,2017,Equity for Punks VI raises £10 million in record time from investors,"BrewDog's sixth Equity for Punks crowdfunding round has raised £10 million within a week of launch, setting a new speed record for the scheme. The raise will fund further international bar openings, continued US infrastructure investment and working capital for the rapidly growing business. The total Equity for Punks investor community now stands at over 100,000 individuals in fifty countries. The milestone reinforces BrewDog's position as the world's most successful consumer brand equity crowdfunding operation and has attracted fresh academic interest in the business model from scholars of entrepreneurial finance and platform economics.",Finance,positive
66,2017-08-10,2017,BrewDog launches Brewgooder charitable beer with social mission,"BrewDog has partnered with Scottish charity Brewgooder to launch a beer whose proceeds fund clean water projects in Malawi. The collaboration reflects growing consumer demand for purpose-driven products and the opportunity for a premium brand to align commercial activity with social impact. The beer, Clean Water Lager, is available across BrewDog's bar estate and through its online shop. Management estimates that the collaboration will raise over £100,000 for Brewgooder's projects in its first year. The initiative has received very positive media coverage and has been cited as an example of genuine rather than performative corporate social responsibility.",UK News,positive
67,2017-10-26,2017,BrewDog wins Best Large Employer in UK Hospitality Awards,"BrewDog has won the Best Large Employer category at the UK Hospitality Awards, recognising its investment in employee training, development and wellbeing across its bar estate. The award is based on employee survey data and independent assessment of HR practices. Employee satisfaction scores are reported to be among the highest in the hospitality sector. The recognition adds to a growing portfolio of employer brand awards and reinforces BrewDog's recruitment proposition as it continues to hire aggressively to staff new bar openings. Management views the employer brand as a key competitive advantage in the tight labour market for hospitality talent.",Business,positive
68,2017-11-09,2017,BrewDog named among the UK's most admired consumer companies,"BrewDog has appeared in Management Today's annual list of the UK's most admired companies, recognised for its exceptional revenue growth, innovative business model and strong brand equity. The company has also been shortlisted for multiple entrepreneurship and innovation awards during the year. Employee satisfaction scores, as measured through the annual Best Companies survey, remain high. Management has credited the company's culture of shared ownership, transparency and product passion for its ability to attract and retain talented individuals in a competitive employment market, positioning the brand as an employer of choice in hospitality.",Business,positive
