id,date,year,headline,body,section,sentiment_label
102,2021-05-25,2021,Equity for Punks investors question governance as CEO controversy deepens,"A group of Equity for Punks investors has submitted formal questions to the BrewDog board about governance arrangements, executive accountability and the handling of the open letter allegations. The investors, coordinating through an online community forum, are asking for greater transparency about the culture review process and for clarity on what consequences, if any, will follow from its findings. The episode has highlighted tensions inherent in the Equity for Punks model, where tens of thousands of small shareholders have limited formal mechanisms to exert pressure on management beyond public pressure campaigns.",Finance,negative
103,2021-07-14,2021,Culture review finds management failings but avoids harshest judgements,"The independent culture review commissioned by BrewDog has been published, finding evidence of management failings, inadequate HR processes and a pattern of behaviour inconsistent with the company's stated values. However, the review falls short of the most serious allegations contained in the open letter, and BrewDog management has cited the more measured findings as partial vindication. Critics, including some open letter signatories, have described the review as inadequate and questioned the independence of the process. The company has published a twenty-point action plan committing to improvements in management training, HR infrastructure and employee feedback mechanisms across all operations.",UK News,negative
104,2021-08-11,2021,BrewDog's new head of people promises genuine cultural transformation,"BrewDog's newly appointed chief people officer has given her first interview, outlining a comprehensive agenda for cultural transformation that she says goes beyond surface-level changes to address systemic issues in how the company manages, develops and rewards its employees. Key commitments include an independent employee relations helpline, enhanced whistleblowing protections, revised performance management frameworks and a significant increase in investment in management training. She acknowledged that rebuilding trust with employees would take time and that the company's credibility would be judged on consistent action rather than statements of intent.",UK News,neutral
105,2021-09-08,2021,BrewDog revenues recover to £90 million as bars reopen post-lockdown,"BrewDog has reported revenues recovering to approximately £90 million following the full reopening of its global bar estate as pandemic restrictions are lifted. The recovery is ahead of management's initial projections, reflecting strong pent-up consumer demand for the out-of-home experience. The direct-to-consumer online channel, which grew substantially during lockdown, has retained a significant portion of its elevated revenue even as bars reopen, suggesting a structural shift in consumer behaviour that benefits BrewDog's multi-channel model. Management has set a revised revenue target of £130 million for 2022 as it enters the post-pandemic recovery phase.",Business,neutral
106,2021-10-14,2021,BrewDog launches employee share scheme for all staff levels,"BrewDog has expanded its employee share scheme to cover all permanent employees, not just senior management, making shares available to bar staff, brewing operatives and support functions for the first time. The scheme provides each employee with shares worth approximately one thousand pounds at the current notional valuation. Management has described the move as a genuine step toward the shared ownership model the company has always claimed to aspire to. Some employees and commentators have questioned whether shares in a loss-making company with a deteriorating valuation represent meaningful value, given the financial pressures the business is currently facing.",Finance,neutral
107,2021-11-18,2021,BrewDog Punk AF leads growing alcohol-free beer market segment,"BrewDog's Punk AF alcohol-free beer has emerged as the leading product in the rapidly growing UK alcohol-free beer market, according to new Nielsen data. The no-and-low alcohol segment has grown by over sixty percent in volume terms over the past two years, driven by health-conscious consumer trends and changing attitudes to drinking among younger consumers. BrewDog has invested in its alcohol-free range as a strategic growth priority, with Punk AF now available in over 15,000 UK retail outlets. The segment represents an opportunity to grow revenue without increasing alcohol consumption, which aligns with the company's evolving sustainability and social responsibility narrative.",Food,positive
108,2021-04-06,2021,"BrewDog's online beer subscription service grows to 200,000 members","BrewDog has reported that its Hop Drop beer subscription service has grown to 200,000 monthly subscribers, making it the largest craft beer subscription business in the UK. The subscription model provides a reliable recurring revenue stream that partially offsets the volatility of bar-based revenues. Average monthly revenue per subscriber has increased following the introduction of premium tier options including limited editions and beer-and-food pairings. Management has identified subscription growth as a priority for the direct-to-consumer channel, targeting 500,000 subscribers by the end of 2022 as part of its post-pandemic revenue recovery plan.",Business,positive
109,2022-01-20,2022,BrewDog faces energy cost crisis as utility bills soar across operations,"BrewDog has disclosed that its energy costs have risen by approximately £4 million on an annualised basis following the surge in wholesale gas and electricity prices. The increase represents a significant additional burden on a company already facing declining revenues and widening losses. Brewing is an energy-intensive process, and the company's Ellon facility and US brewery are both major consumers of electricity and heat. Management is exploring energy hedging strategies and efficiency investments to reduce exposure, but has acknowledged that short-term cost relief is limited given existing contractual positions with energy suppliers.",Finance,negative
110,2022-02-10,2022,BrewDog revenues disappoint as bar estate faces structural headwinds,"BrewDog has reported full-year 2021 revenues of £94 million, falling short of the £130 million target management had set, as the bar estate continues to face structural headwinds from rising operating costs, staff shortages and changing consumer behaviour in the post-pandemic market. Gross margins have compressed as energy and ingredient costs have risen sharply. Several underperforming bars have been closed as part of an ongoing rationalisation of the estate. Management has declined to provide specific revenue guidance for 2022, citing significant uncertainty about the macroeconomic environment and the continuing impact of cost-of-living pressures on consumer spending.",Finance,negative
111,2022-03-11,2022,BrewDog management departures accelerate amid restructuring programme,"BrewDog has experienced a significant wave of senior management departures over the past six months, with the heads of marketing, HR, finance and international operations all leaving the company. The departures have created significant institutional knowledge gaps at a critical time for the business. Recruiters familiar with the hospitality sector have described the challenge of attracting senior talent to BrewDog given the combination of reputational issues, financial instability and the profile of the management culture controversies. Management has engaged an executive search firm to fill the vacancies but has acknowledged that the recruitment process is taking longer than expected.",Business,negative
112,2022-04-22,2022,BrewDog faces renewed staff controversy over tipping practices,"BrewDog has been the subject of renewed controversy following a report alleging that the company had retained a proportion of tips intended for bar staff, in breach of industry standards and new legislation on tipping transparency. The company has denied the allegation and says all tips are passed in full to employees. However, a number of current and former bar staff have posted statements on social media contradicting management's account. The episode has attracted commentary from trade unions and politicians and has added to the growing body of negative coverage about BrewDog's treatment of its frontline employees.",UK News,negative
113,2022-05-12,2022,BrewDog faces boycott calls over insensitive public comments,"BrewDog has been the subject of boycott calls on social media following commentary attributed to a senior company figure that was deemed by critics to be insensitive and inappropriate. The company issued an apology and retraction within twenty-four hours, but the episode added to a growing list of reputational incidents damaging to the brand. Brand tracking data published in the wake of the controversy showed a further deterioration in brand sentiment scores among BrewDog's core demographic of younger urban consumers. Management acknowledged the damage and reiterated its commitment to more careful oversight of public communications.",UK News,negative
114,2022-06-16,2022,James Watt steps back from BrewDog CEO role amid ongoing criticism,"James Watt has announced that he is stepping back from the chief executive role at BrewDog, a position he has held since co-founding the company in 2007. Watt will transition to a non-executive chairman role while a search is conducted for an external CEO to lead the business. The announcement follows sustained media and investor pressure following the open letter controversy and subsequent governance concerns. Watt acknowledged in an interview that the company needed a different type of leadership to navigate its current challenges and to demonstrate to employees that management accountability is genuine and not merely performative.",UK News,negative
115,2022-07-28,2022,BrewDog loses major supermarket shelf space as brand struggles,"BrewDog has lost a significant proportion of its mainstream supermarket listings following a review by a major UK grocery retailer that reduced the range stocked and deprioritised BrewDog products in favour of smaller independent craft brands. The loss of shelf space represents a material impact on wholesale revenue. Retail buyers quoted anonymously in the trade press cited the brand's reputational issues, declining consumer preference scores and the availability of comparable quality craft beer from producers without the same controversies as factors in the decision. BrewDog has described the reduction as a routine ranging decision but analysts regard it as a significant negative for the business.",Business,negative
116,2022-08-05,2022,BrewDog appoints first external CEO from Diageo background,"BrewDog has appointed James Arrow, a former senior executive at Diageo, as its first external chief executive. Arrow brings significant experience in scaling global drinks brands and managing complex international operations. His appointment has been welcomed by some investor groups as a signal of greater professional management discipline, but has been viewed sceptically by others who question whether a corporate drinks industry veteran can maintain the brand's distinctive identity. The incoming CEO has said his immediate priorities are to stabilise the business financially, improve the culture and restore confidence among employees and investors.",Business,neutral
117,2022-10-19,2022,BrewDog closes fifteen bars as financial pressure mounts significantly,BrewDog has confirmed the closure of fifteen bars across the UK and US as the company implements a strategic review of its estate. The closures affect sites in smaller cities and towns that have not achieved sustainable trading performance and are part of a broader effort to improve the profitability of the estate. The redundancies associated with the closures affect approximately 200 employees. Critics have noted that the closure programme represents a significant reversal of the aggressive expansion strategy that characterised the company's growth phase and have questioned the financial assumptions underpinning the original expansion decisions.,Business,negative
118,2022-12-08,2022,BrewDog revenues fall for second consecutive year amid cost crisis,"BrewDog has reported revenues of £83 million for the financial year, a decline of approximately twelve percent from the prior year, marking the second consecutive year of falling sales. The revenue decline reflects bar closures, weakening consumer confidence in the cost-of-living crisis and the reputational damage associated with sustained negative media coverage. Pre-tax losses have widened to approximately £20 million. Management has described the financial performance as unacceptable and has announced a comprehensive restructuring programme aimed at returning the company to profitability within two years through cost reduction and estate rationalisation.",Finance,negative
119,2023-01-12,2023,BrewDog's competitive position erodes as craft market matures,"Analysis by drinks industry consultancy IWSR suggests that BrewDog's share of the UK craft beer market has declined materially over the past two years as the category has attracted increasing competition from both established drinks groups and new independent producers. The company's brand, once synonymous with craft beer in the UK consumer consciousness, is now competing in a fragmented market where its reputational challenges give smaller, cleaner competitors an advantage with discerning consumers. Management has acknowledged the competitive deterioration and identified targeted product investment and marketing reinvention as priorities for the turnaround strategy.",Business,negative
120,2023-02-14,2023,New BrewDog CEO promises culture overhaul in first major address,"Incoming chief executive James Arrow has given his first major public address since joining BrewDog, outlining a comprehensive agenda for cultural transformation, operational improvement and financial stabilisation. Arrow acknowledged that the company had serious and unresolved cultural issues and committed to a series of specific actions including improvements to HR practices, greater employee voice mechanisms and a zero-tolerance approach to bullying and harassment. He described the financial situation as challenging but manageable with the right operational disciplines in place. Some former employees and commentators have welcomed the address but reserved judgement pending concrete action.",UK News,neutral
121,2023-03-16,2023,BrewDog's financial distress signals wider craft beer sector slowdown,"BrewDog's financial difficulties are being interpreted by industry analysts as a leading indicator of a broader slowdown in the UK craft beer market. Rising costs, a consumer spending squeeze and market saturation in major urban centres are combining to challenge the economics of premium craft beer at scale. Several other mid-sized craft brewers have reported financial difficulties in recent months. Analysts at Shore Capital note that the conditions that made craft beer a high-growth category in the 2010s are no longer as favourable, requiring a fundamental reassessment of growth assumptions and capital allocation across the sector.",Finance,negative
122,2023-04-20,2023,BrewDog restructures debt as lenders review terms with scrutiny,"BrewDog has completed a renegotiation of its debt facilities with its principal lenders, securing revised terms that extend maturities and provide greater operational flexibility. The restructuring has been described by management as a prudent financial management measure, but the process has attracted scrutiny from financial journalists who note that the company's leverage metrics have deteriorated materially over the past two years. The debt restructuring follows the closure of fifteen bars and ongoing losses, and has prompted questions about the adequacy of the company's liquidity position in a challenging trading and macroeconomic environment.",Finance,negative
123,2023-05-04,2023,BrewDog's hospitality division faces acute staff retention crisis,"BrewDog's bar operations are experiencing acute staff retention difficulties, with employee turnover in the bar estate running at over one hundred percent annually according to internal data reported by industry media. The retention crisis has been linked to the company's reputational issues following the open letter, competitive pay rates and the uncertainty created by the ongoing restructuring. High turnover is directly affecting the quality of the customer experience in bars and contributing to the decline in consumer satisfaction scores. Management has acknowledged the problem and committed to improving pay and working conditions as part of the culture transformation programme.",UK News,negative
124,2023-06-29,2023,BrewDog's premium positioning faces pressure from consumer downturn,"BrewDog's premium-priced products and bar experiences are facing increasing pressure from the ongoing consumer spending downturn, which is prompting households to trade down to cheaper alternatives. The company's average transaction value in its bar estate has declined and footfall metrics have weakened across many sites. Wholesale revenue has also been affected as supermarkets have seen a shift in consumer purchasing toward own-label and value brands. Management has responded by launching a series of value-oriented promotions, a tactic that critics argue is inconsistent with the premium brand positioning that has historically underpinned BrewDog's pricing power and margins.",Business,negative
125,2023-08-17,2023,Martin Dickie exits BrewDog co-founder role amid restructuring,"Martin Dickie, co-founder of BrewDog and the company's head of brewing since its inception, has announced that he is leaving the company as part of the ongoing restructuring. Dickie's departure removes the last of the founding management team from active operational involvement in the business. His exit has been described as amicable by the company but has been widely interpreted as a further sign of the internal turmoil and cultural disruption affecting the organisation. The departure of BrewDog's most visible craft beer figure raises questions about whether the company can maintain its product quality and brewing credentials under entirely new management.",UK News,negative
126,2023-09-28,2023,BrewDog's auditors raise going concern doubts in latest accounts,"The external auditors of BrewDog have included a going concern qualification in the company's latest annual accounts, noting that the combination of declining revenues, mounting losses and elevated debt levels creates material uncertainty about the company's ability to continue as a going concern for the twelve months following the balance sheet date. The qualification is a significant public disclosure of the company's financial fragility and has attracted extensive media coverage. Going concern qualifications are unusual for companies of BrewDog's size and profile and typically signal that auditors have identified a credible risk of insolvency in the near term.",Finance,negative
127,2023-10-11,2023,BrewDog posts £35 million annual loss as turnaround falters,"BrewDog has reported a pre-tax loss of £35 million for the financial year, its largest to date, as revenues continue to decline and restructuring costs add to the financial burden. The loss reflects a combination of declining trading, impairment charges on bar assets, redundancy costs and professional fees associated with the debt restructuring and governance reviews. The company's net debt position has deteriorated to approximately £90 million. Management has described the scale of the loss as a consequence of decisions made in prior years and has outlined further cost reduction measures, but has provided no guidance on when the business will return to profitability.",Finance,negative
128,2023-11-14,2023,BrewDog considers strategic options including full or partial sale,"BrewDog's board has confirmed that it is exploring strategic options for the company, including a full sale, a partial sale of non-core assets or a further equity investment by a new institutional partner. The process has been mandated to a major investment bank. Potential acquirers identified in press reports include international drinks conglomerates Asahi, Carlsberg and AB InBev, all of which have previously invested in premium craft beer brands. A full sale would represent the end of BrewDog's existence as an independent company and a significant crystallisation of losses for Equity for Punks retail investors who invested at the TSG-implied valuation.",Finance,negative
129,2023-12-05,2023,BrewDog closes Columbus DogHouse Hotel as US cost cuts deepen,"BrewDog has announced the closure of its flagship Columbus, Ohio DogHouse Hotel, the signature asset of its US operation, as the company continues to rationalise its asset base in the face of mounting losses. The closure, which affects twenty-five employees, marks a significant retreat from the ambitious US expansion programme that was central to the company's growth strategy just five years ago. The Columbus brewery remains open but management has indicated that the scale of US operations will be significantly reduced. The hotel closure has attracted extensive media coverage as a symbol of the company's wider decline from its peak ambitions.",Business,negative
130,2024-01-18,2024,BrewDog in talks with restructuring advisers over financial position,"BrewDog has confirmed that it is in discussions with financial advisers including a major restructuring firm about options for addressing its deteriorating financial position. The company's revenues have continued to decline and its debt load is becoming increasingly difficult to service at current trading levels. Options under consideration are reported to include asset disposals, a debt-for-equity swap, a strategic investment by a new institutional partner, or a formal insolvency process. The disclosure has prompted a significant downward revaluation of the notional share price implied by Equity for Punks rounds, causing significant distress among the company's 100,000-plus retail investors.",Finance,negative
131,2024-02-14,2024,BrewDog seeks emergency bridging finance as cash reserves fall sharply,"BrewDog has approached its banking syndicate for emergency bridging finance as the company's cash reserves have fallen to levels that management has described as insufficient to meet short-term obligations. The request for additional liquidity has triggered concern among existing lenders about whether the company can service its existing debt facilities. The company's banking advisers have been mandated to explore all options including a refinancing, an asset disposal programme and potential sale of the company. The situation is described by insiders as a genuine financial emergency requiring urgent resolution to avoid a formal insolvency process.",Finance,negative
132,2024-03-07,2024,BrewDog sells twenty bars to private equity buyer as cash crisis deepens,"BrewDog has completed the sale of twenty of its UK bar locations to a private equity-backed hospitality operator for an undisclosed consideration reported to be significantly below book value. The disposals generate immediate liquidity to address short-term debt maturities but substantially reduce the group's revenue-generating asset base. Management has described the sale as part of a transformation programme to create a leaner, more focused business, but analysts note that the transaction crystallises large impairment losses that will worsen the already severe balance sheet position. The surviving bar estate comprises approximately forty UK locations following the sale.",Finance,negative
133,2024-03-28,2024,BrewDog Ellon brewery operations suspended during administration review,"Operations at BrewDog's flagship Ellon brewery have been temporarily suspended as the administrators conduct a financial review and seek buyers for the asset. The suspension has halted production of Punk IPA and the company's full range of products, creating shortages in retail and wholesale channels. The interruption to supply is expected to further damage the brand's remaining commercial relationships with supermarkets and pub groups. Brewing staff at the site remain employed but have been placed on reduced hours pending clarity on the outcome of the sale process. The interruption underscores the operational complexity of managing a large-scale industrial asset through an insolvency process.",Business,negative
134,2024-04-24,2024,Equity for Punks investors face near-total loss on crowdfunding holdings,"Equity for Punks investors, who collectively put approximately £100 million into BrewDog across multiple crowdfunding rounds, are facing near-total losses on their investments as the company's financial distress deepens. The most recent internal share valuation shows a per-share price approximately ninety percent below the level implied by the TSG Consumer Partners investment in 2015. The situation has attracted commentary from consumer protection advocates and financial regulators, who have noted that retail investors in illiquid equity crowdfunding schemes have very limited recourse when a company's performance deteriorates sharply. Several investor groups have engaged legal counsel to explore potential claims.",Finance,negative
