id,date,year,headline,body,section,sentiment_label
69,2017-05-17,2017,BrewDog's technology investment creates most advanced craft brewery in Europe,"BrewDog has completed a major automation and technology investment at its Ellon facility, installing state-of-the-art brewing control systems, automated packaging lines and a proprietary quality management platform. The investment, totalling approximately £15 million, is intended to improve consistency, reduce waste and lower the unit cost of production as volumes continue to grow. The company claims that Ellon is now the most technologically advanced craft brewery in Europe. The combination of craft brewing expertise and industrial-scale automation is seen by management as a key differentiator that allows BrewDog to maintain quality at scale while preserving its craft identity.",Technology,positive
70,2017-12-14,2017,BrewDog reports record revenue year approaching one hundred million pounds,"BrewDog has confirmed that it is on track to exceed its £100 million revenue target for the full year, a historic milestone for the UK craft brewing industry. The achievement reflects seven consecutive years of rapid growth driven by bar estate expansion, international development and strong direct-to-consumer sales. EBITDA has improved as the company's more established bars reach maturity and generate higher margins. Management has outlined a roadmap for continued international expansion and has mentioned the possibility of a future IPO or secondary share sale to provide liquidity for early investors in the Equity for Punks scheme.",Finance,positive
71,2018-03-05,2018,BrewDog revenues hit £100 million milestone as growth trajectory holds,"BrewDog has confirmed revenues of £101 million for the financial year, becoming the first UK craft brewer to break the £100 million revenue barrier. The achievement reflects seven consecutive years of rapid growth driven by bar estate expansion, international development and strong direct-to-consumer sales. EBITDA has improved as the company's more established bars reach maturity and generate higher margins. Management has outlined a roadmap for continued international expansion and a potential IPO or secondary share sale to provide liquidity for early investors, though no timetable has been committed to at this stage.",Finance,positive
72,2018-04-10,2018,BrewDog launches Punk AF alcohol-free beer to capitalise on wellness trend,"BrewDog has launched Punk AF, an alcohol-free version of its iconic Punk IPA, responding to growing consumer demand for premium non-alcoholic alternatives. The product has been developed using a proprietary cold filtration technique that the company claims preserves the flavour profile of the original beer while removing all alcohol. Punk AF is being positioned as a premium product rather than a compromise, priced at parity with the alcoholic version. The launch reflects the broader premiumisation of the no-and-low alcohol segment and BrewDog's recognition that the segment represents a significant incremental revenue opportunity with improving margins.",Food,positive
73,2018-05-18,2018,BrewDog opens Brisbane brewery in Australia to serve Asia-Pacific market,"BrewDog has opened a brewing facility in Brisbane, Australia, its third production site outside the UK and a major step in its Asia-Pacific expansion strategy. The Brisbane brewery will supply fresh locally-brewed beer to BrewDog bars across Australia and support distribution growth in nearby Asian markets including Japan and Singapore. The investment reflects management's view that local production is essential for both product quality and commercial competitiveness in high-growth international markets. The Brisbane site will also function as a DogTap brewpub and visitor experience, replicating the successful Columbus model in the Southern Hemisphere.",Business,positive
74,2018-06-07,2018,BrewDog's bar technology platform improves customer experience and data,"BrewDog has deployed a proprietary technology platform across its bar estate that integrates point-of-sale data, customer loyalty tracking and real-time inventory management. The platform allows the company to collect detailed data on consumer preferences and purchasing behaviour, informing product development and marketing strategy. Customer experience scores have improved following the deployment. The data capabilities also support the company's direct-to-consumer marketing efforts, allowing personalised communications with the Equity for Punks investor and bar customer communities. Management has described the technology investment as a significant competitive advantage in the increasingly data-driven hospitality sector.",Technology,positive
75,2018-07-25,2018,BrewDog launches Lost Lager to challenge mainstream beer brands,"BrewDog has launched Lost Lager, its first mainstream lager product, targeting the mass market segment that the company has historically avoided. The launch represents a significant strategic evolution: while the craft credentials remain central to the brand, management believes there is an opportunity to capture share from mainstream lager brands by offering a premium-positioned alternative at accessible price points. Lost Lager is being rolled out across the UK bar estate and wholesale channels simultaneously. Some craft beer enthusiasts have expressed scepticism about the move, but management argues that quality and integrity can be maintained across all price points in the range.",Food,positive
76,2018-09-20,2018,BrewDog receives international sustainability award for green brewing,"BrewDog has received an international sustainability award recognising its investments in renewable energy, waste reduction and sustainable packaging at its Ellon facility. The company has committed to becoming carbon neutral across its UK operations within two years, a target that management believes is achievable through a combination of renewable energy procurement, on-site solar generation and carbon offset programmes. The sustainability credentials are increasingly important for the company's premium brand positioning, as consumer research indicates that environmental responsibility is a significant purchasing driver among BrewDog's core demographic of younger, educated urban consumers.",UK News,positive
77,2018-10-17,2018,BrewDog to open DogHouse Hotel at Columbus brewery site in US,"BrewDog has confirmed that a second DogHouse Hotel will be developed at the Columbus, Ohio brewery site, following the success of the Ellon hotel concept. The Columbus DogHouse will accommodate up to forty guests in rooms with built-in tap handles and will offer immersive brewing experiences and food and beverage packages. The hotel is expected to open in late 2019 and will be marketed as a destination experience for craft beer enthusiasts visiting the Midwest. Revenue projections from the hospitality business line are expected to add approximately five percent to group turnover once both hotel sites are fully operational.",UK News,positive
78,2018-11-28,2018,BrewDog's international licensing model targets Asian growth markets,"BrewDog has signed licensing agreements with operators in Japan, Singapore and South Korea, allowing local operators to open BrewDog-branded bars and serve a selection of locally-brewed BrewDog beers. The licensing model reduces capital requirements and execution risk compared to directly owned international operations. Management expects the Asian licensing revenue to contribute materially to group turnover within three years as the agreements ramp to full trading capacity. The move is seen as the most capital-efficient route to establishing a brand presence in high-growth Asian markets where craft beer consumption is expanding rapidly.",Business,positive
79,2018-02-22,2018,BrewDog's Ellon facility achieves carbon neutral brewing certification,"BrewDog has announced that its Ellon brewery has achieved carbon neutral certification, making it one of the first large-scale commercial breweries in the world to do so. The certification, awarded by a leading independent environmental auditor, recognises investments in renewable energy, waste heat recovery, water efficiency and certified carbon offset programmes. The company has committed to extending carbon neutral status to all of its global brewing operations within two years. The announcement has been welcomed by environmental campaigners and the sustainability press, and is expected to strengthen BrewDog's brand positioning among environmentally conscious consumers.",UK News,positive
80,2019-01-28,2019,BrewDog revenues grow to £112 million despite emerging market headwinds,"BrewDog has reported revenues of £112 million for the financial year, a growth rate that, while positive, represents a material deceleration from prior years. Management has attributed the slowdown to a more competitive UK bar market, rising labour costs and the impact of Brexit uncertainty on consumer confidence. EBITDA margins have come under modest pressure as the company continues to invest in new market development. The slowdown in growth has prompted some Equity for Punks investors to ask questions about the company's path to profitability and the long-term sustainability of the bar estate expansion model given rising costs.",Finance,neutral
81,2019-03-15,2019,Former BrewDog employees raise concerns about toxic workplace culture,"A group of former BrewDog employees has circulated a letter to industry contacts describing what they characterise as a culture of fear and anxiety within the company. The letter, which has been seen by this newspaper, alleges that staff are routinely subjected to aggressive management practices, unrealistic performance expectations and a reluctance to raise concerns without fear of retribution. BrewDog management has firmly denied the allegations, attributing them to a small number of disgruntled former employees. The claims have prompted discussion within the hospitality industry about the gap between BrewDog's publicly stated employee values and the lived experience of workers at the company.",UK News,negative
82,2019-05-10,2019,Industry insiders question BrewDog's punk credentials as brand matures,"A critical feature in trade publication The Morning Advertiser has examined whether BrewDog has remained true to its founding punk values as it has grown into a £1 billion corporate entity with institutional investors, a global bar estate and mainstream supermarket listings. Former employees and industry observers quoted in the article suggest that the company's rebellious image is increasingly a marketing construct rather than a lived reality. The feature notes that many of the independent craft brewers BrewDog positioned itself against in its early years now regard the company as part of the establishment it once claimed to challenge, branding it as fake punk.",UK News,negative
83,2019-07-22,2019,BrewDog apologises after marketing stunt causes widespread offence,"BrewDog has issued a public apology following a marketing campaign that generated significant criticism on social media and in the national press. The campaign, which involved a graphic designed to shock and provoke, was described by critics as irresponsible and offensive. The Advertising Standards Authority has confirmed it is investigating complaints. The episode is the latest in a series of controversies that critics argue reflect a corporate culture that prioritises attention-seeking over genuine values. Management defended the campaign as consistent with the brand's challenger ethos but acknowledged that the execution had fallen short of acceptable standards.",UK News,negative
84,2019-09-05,2019,Toxic workplace allegations resurface as more former staff speak out,"Additional former BrewDog employees have come forward to corroborate earlier allegations about the company's internal culture, with several describing experiences of bullying, discrimination and managerial misconduct. The allegations, reported in detail by Vice magazine and subsequently picked up by national newspapers, have prompted calls from shareholder-investors for an independent review of employment practices. BrewDog management has initiated what it describes as a comprehensive culture audit but has not committed to making the findings public. The controversy has attracted the attention of trade unions, who have called for formal recognition at BrewDog facilities.",UK News,negative
85,2019-04-12,2019,Rapid expansion leaves BrewDog's cultural foundations strained say analysts,"An analysis by management consultants McKinsey has highlighted BrewDog as an example of a fast-growing consumer brand where the pace of expansion has outstripped the development of management infrastructure, HR processes and cultural embedding mechanisms. The report notes that companies growing at BrewDog's pace frequently experience cultural deterioration as the personal relationships and informal norms of early-stage businesses are replaced by formal hierarchies before appropriate processes are in place. The analysis appears prescient in light of recent negative employee commentary about the company's internal culture and management practices.",Business,negative
86,2019-11-14,2019,BrewDog growth stalls as competition in craft market intensifies sharply,"BrewDog's latest trading update has revealed that revenues have plateaued amid intensifying competition in the UK craft beer market and ongoing challenges in the US operation. Several bar closures have been announced as the company rationalises underperforming sites in the estate. Management has acknowledged that the rapid expansion of the bar estate in 2016 and 2017 resulted in some locations that have not achieved adequate returns on capital. An efficiency programme is under way to improve operating margins and reduce the cost base. Some analysts have begun to revise their growth assumptions downward, raising questions about the sustainability of the company's implied valuation.",Finance,negative
87,2019-08-30,2019,BrewDog faces scrutiny over beer ingredients and sourcing claims,Investigative journalism by the BBC has raised questions about BrewDog's marketing claims regarding the sourcing and ingredients of several products. The reporting alleges that claims about the use of locally-sourced Scottish ingredients in certain products are inaccurate and that labelling descriptions overstate the provenance of the beers. BrewDog has disputed the specific claims but has acknowledged a need for greater precision in its product marketing materials. The episode adds to a broader pattern of scrutiny of the company's marketing practices and its tendency to make aspirational claims that attract regulatory and journalistic challenge.,UK News,negative
88,2019-12-20,2019,BrewDog faces questions over accuracy of environmental claims,"Investigative reporting by The Guardian has questioned the accuracy of some of BrewDog's environmental and sustainability claims, suggesting that the company's carbon neutral commitments have been overstated and that key metrics have been selectively reported. The allegations of greenwashing have proved damaging to a brand that has invested heavily in its environmental credentials as a differentiator. BrewDog management has disputed the characterisation of its sustainability programme but has committed to commissioning an independent audit of its environmental data. Consumer trust metrics tracked by YouGov have shown a modest but statistically significant decline following the reporting.",UK News,negative
89,2019-10-18,2019,BrewDog's growth model questioned as market conditions deteriorate,A critical analysis by Peel Hunt equity analysts has raised questions about the sustainability of BrewDog's business model in the context of deteriorating market conditions. The note argues that the company's reliance on bar estate revenue growth to justify its TSG-implied valuation requires a pace of new openings and like-for-like growth that appears increasingly difficult to sustain. The analysis also highlights the reputational headwinds created by the workplace culture controversies as a factor that could affect both bar footfall and the company's ability to attract talented employees. Several institutional investors are said to be reassessing their interest in any potential BrewDog secondary transaction.,Finance,negative
90,2020-02-12,2020,BrewDog posts first annual loss as expansion costs bite hard,"BrewDog has reported its first annual pre-tax loss, of approximately £6 million, as the costs of its ambitious international expansion programme have exceeded revenue growth in the near term. The loss reflects heavy capital expenditure on new bar openings in the US and Europe, elevated depreciation charges and one-off costs associated with the culture review programme. Management has described the loss as an investment in long-term value creation and has provided guidance for a return to profitability within two years. Equity for Punks investors have expressed mixed reactions, with some expressing concern about the financial position while others remain supportive of the long-term strategy.",Finance,negative
91,2020-03-18,2020,BrewDog repurposes distillery to produce hand sanitiser for NHS,"BrewDog has announced that it is repurposing part of its spirits distillery to produce hand sanitiser for distribution to NHS hospitals and care homes free of charge. The initiative, announced within days of the UK lockdown, has generated widespread positive media coverage and public goodwill. The company is producing approximately 50,000 units of sanitiser per week and has donated over half a million units in the first month. Management has described the initiative as a straightforward response to a public health emergency, consistent with the company's stated values of community and social responsibility during a time of national crisis.",UK News,positive
92,2020-04-15,2020,Covid-19 pandemic forces BrewDog to close entire global bar estate,"The coronavirus pandemic has forced BrewDog to close all of its bars globally as government-mandated lockdown measures take effect across the UK, US and Europe. The sudden loss of bar revenue represents a severe shock to the company's cash position, given that the bar estate is the largest revenue contributor. Management has responded by pivoting to an online retail model, launching a home delivery service and repurposing its brewing facilities to produce hand sanitiser for NHS hospitals. The company has applied for government support schemes including the Job Retention Scheme, which has allowed it to furlough the majority of its bar staff.",UK News,negative
93,2020-06-08,2020,James Watt faces criticism over staff communications during pandemic,"James Watt has faced significant criticism following the publication of a series of internal communications in which he is alleged to have placed undue pressure on employees, used aggressive language and failed to demonstrate adequate empathy during the pandemic-related restructuring. Screenshots shared on social media have attracted widespread negative commentary and reignited allegations about BrewDog's internal culture. The company has declined to confirm the authenticity of the communications. PR professionals quoted in trade media have described the episode as a significant reputational crisis that compounds earlier negative coverage about the company's employment practices and management conduct.",UK News,negative
94,2020-08-20,2020,BrewDog's pivot to home delivery partially offsets lockdown revenue losses,"BrewDog's rapid pivot to direct-to-consumer home delivery has partially mitigated the devastating impact of bar closures during the pandemic. Online revenue has grown by approximately two hundred percent year-on-year as consumers confined to home have sought out premium drinks experiences. The company has also benefited from a surge in sales of its Punk AF alcohol-free range, which has seen growing consumer interest as health consciousness rises during lockdown. Management estimates that the direct-to-consumer channel will contribute a materially higher proportion of group revenue on a sustained basis, even after bars reopen in the post-pandemic recovery period.",Business,neutral
95,2020-10-01,2020,Open letter from sixty-one former employees alleges culture of fear,"An open letter signed by sixty-one former BrewDog employees has been published online, making detailed allegations of a pervasive culture of fear, bullying and managerial misconduct at the company. The letter, widely shared on social media and reported prominently by national newspapers and broadcasters, describes specific incidents of alleged harassment, intimidation and discrimination. It directly challenges the company's stated values and public image, accusing management of hypocrisy and of treating employees as expendable. BrewDog management has described the allegations as deeply distressing and announced a formal independent review, but critics have questioned whether an internally commissioned review can be genuinely independent.",UK News,negative
96,2020-05-14,2020,BrewDog launches online craft beer masterclass platform during lockdown,"BrewDog has launched a digital platform offering online craft beer education and masterclasses, designed to engage its community of enthusiasts during lockdown. The platform includes video content from the company's brewers, tasting sessions and interactive tutorials on beer styles and food pairing. Over 50,000 users registered in the first week of launch. The initiative has generated positive media coverage and reinforced the company's position as the leading consumer authority on craft beer in the UK. Management believes the digital education platform will become a permanent part of the business model, generating subscription revenue and driving sustained brand engagement.",Technology,positive
97,2020-09-22,2020,BrewDog launches MakeEarthGreatAgain environmental campaign,"BrewDog has launched a high-profile environmental campaign, pledging to remove twice as much carbon from the atmosphere as it produces and to invest over thirty million pounds in forests, rewilding projects and renewable energy. The campaign has attracted significant media coverage and has been praised by some environmental groups. However, others have criticised the headline claims as misleading and the carbon accounting methodology as insufficiently rigorous. The campaign appears designed in part to shift media narrative away from the ongoing open letter controversy and toward the company's environmental credentials, a move that critics have described as purpose-washing.",UK News,neutral
98,2020-12-10,2020,BrewDog revenues fall sharply as pandemic impact deepens significantly,"BrewDog has reported a sharp decline in annual revenues, falling from £112 million to approximately £77 million as the extended impact of Covid-19 lockdowns devastates the bar estate business. The pre-tax loss has widened to approximately £11 million. Cash reserves have been reduced by the combined impact of operating losses, debt service obligations and continued capital expenditure on committed bar fit-outs. Management has secured additional debt financing from its banking partners and has indicated that a further equity raise is under consideration to strengthen the balance sheet and fund the post-pandemic recovery strategy.",Finance,negative
99,2021-01-25,2021,Open letter fallout: James Watt apology fails to quell controversy,"James Watt has published an open letter apology in response to the damaging allegations made by former employees, acknowledging that the company has fallen short of its stated values and that he accepts personal responsibility for aspects of the culture described. However, the apology was met with a mixed reception: while some former employees expressed cautious appreciation for the acknowledgement, others described it as inadequate and questioned whether it was motivated by genuine contrition or reputational management. Several current employees have also raised concerns publicly, suggesting that the cultural issues are ongoing rather than purely historical.",UK News,negative
100,2021-02-08,2021,BrewDog pledges fifty percent of profits to sustainability initiatives,"BrewDog has announced a new commitment to direct fifty percent of its post-tax profits to environmental and social initiatives, as part of what management describes as a fundamental reorientation of the company's purpose. The pledge covers both its carbon negative brewing programme and new social investments in community regeneration and employee welfare. The announcement has been welcomed by environmental campaigners, though some have noted that the company's current unprofitable trading position means the commitment carries no immediate financial cost. Critics have characterised the announcement as an attempt to rebuild the brand following the open letter controversy through purpose-washing rather than genuine structural change.",UK News,negative
101,2021-03-18,2021,BrewDog commissions external culture review amid ongoing controversy,"BrewDog has announced the appointment of an external consultancy to conduct a comprehensive review of its workplace culture following the open letter controversy and sustained media criticism. The review will encompass all UK and international operations and will include anonymous surveys, structured interviews and a review of HR processes and management practices. The company has committed to publishing a summary of the findings and an action plan. Critics have noted that external culture reviews are typically slow and that the bar for meaningful structural change is high, particularly where the founders retain operational control of the business.",UK News,negative
