id,date,year,headline,body,section,sentiment_label
1,2010-03-14,2010,BrewDog raises pint to craft beer revolution in Scotland,"Aberdeen-based BrewDog has emerged as one of the most disruptive forces in the UK brewing industry, challenging the dominance of large multinational lager brands with its range of bold, high-alcohol craft ales. Founded in 2007 by James Watt and Martin Dickie, the company has grown rapidly by targeting young consumers disillusioned with mainstream beer. Revenue for the year is expected to reach £1.2 million, a significant milestone for a brewery that began in a small industrial unit. Industry analysts describe the firm's growth trajectory as exceptional for an independent brewer of its age and note the company's punk ethos as a genuine point of competitive differentiation.",Business,positive
2,2010-05-22,2010,Punk IPA wins gold at World Beer Championships in Chicago,"BrewDog's flagship Punk IPA has taken gold at the World Beer Championships in Chicago, bringing international recognition to the Scottish craft brewer. The award validates the company's strategy of producing uncompromising, flavour-forward beers rather than competing on price with mass-market lagers. James Watt said the award demonstrated that British craft beer could compete on the world stage. The win is expected to accelerate retail distribution growth and boost direct online sales, which have become an increasingly important revenue channel for the independent brewery.",Food,positive
3,2010-07-10,2010,BrewDog launches Equity for Punks crowdfunding scheme,"BrewDog has launched an innovative crowdfunding initiative called Equity for Punks, offering fans the opportunity to purchase shares in the company directly and become co-owners of the brewery. The fundraising round aims to raise £500,000 in growth capital while simultaneously building a loyal community of brand advocates. The scheme bypasses traditional venture capital routes, allowing the company to retain independence while funding expansion of its Fraserburgh production facility. Co-founder James Watt described the initiative as a revolution in the relationship between a business and its consumers, positioning investment as an act of cultural identity.",Finance,positive
4,2010-09-18,2010,Craft beer sector sees surge in consumer interest across UK,"A new report from the British Beer and Pub Association highlights a marked shift in consumer preferences away from standard lagers toward craft ales and premium beers. BrewDog is cited as the primary driver of this trend among under-35 consumers, with its provocative branding and irreverent marketing generating significant word-of-mouth growth. The company's direct-to-consumer model, combining online sales with its growing bar estate, is seen as a template for other craft producers. Analysts predict the craft segment could account for five percent of total beer volume within a decade if current growth rates are sustained.",Business,positive
5,2010-11-04,2010,"BrewDog Equity for Punks raises £600,000 from 1,300 investors","BrewDog's inaugural Equity for Punks crowdfunding campaign has exceeded its target, raising £600,000 from approximately 1,300 individual investors. The successful raise represents one of the first examples of a UK consumer brand using equity crowdfunding as a primary capital-raising mechanism. The funds will be directed toward a new bottling line and expanded cold storage at the Fraserburgh site, increasing production capacity by an estimated forty percent. Co-founder Martin Dickie said the support from the punk community had been overwhelming and that the company would honour its commitment to transparency with all shareholder-investors.",Finance,positive
6,2010-12-15,2010,BrewDog opens flagship bar in Edinburgh city centre,"BrewDog has opened its third bar, a flagship venue in Edinburgh's Cowgate district, as part of an accelerating strategy to build a national network of owned retail outlets. The bar estate is central to the company's business model, providing high-margin revenue and acting as a showcase for new product development and brand experience. The Edinburgh site features forty taps, a bottle shop and dedicated tasting area. Management believes that owning the entire consumer touchpoint from brewery to bar is a key competitive advantage that will support long-term revenue growth and brand loyalty in an increasingly crowded craft beer market.",Food,positive
7,2010-08-15,2010,BrewDog challenges beer establishment with provocative advertising campaign,"BrewDog has launched a new advertising campaign that directly mocks the marketing language and imagery of major lager brands, positioning itself as the antithesis of what it calls the corporate beer machine. The campaign, running primarily on digital and out-of-home channels, has generated significant organic sharing and media pickup. The Advertising Standards Authority has received twenty complaints about two executions but has declined to require their withdrawal. Management views the regulatory scrutiny as confirmation that the campaign is generating maximum reach, and brand awareness tracking shows a meaningful increase among consumers aged 18 to 34.",UK News,positive
8,2010-10-05,2010,BrewDog's Tactical Nuclear Penguin sets world beer strength record,"BrewDog has produced a beer with an alcohol content of thirty-two percent, breaking the world record for beer strength. Tactical Nuclear Penguin, available in limited quantities at over thirty pounds per bottle, has generated international media coverage and cemented BrewDog's reputation as the most provocative brewer in the world. The stunt has driven a significant spike in direct-to-consumer sales and attracted press enquiries from media across forty countries. Management insists that the record-breaking beer is a genuine product and not merely a marketing exercise, though it acknowledges that the publicity value substantially exceeds the revenue contribution from the small-batch release.",Food,positive
9,2011-02-28,2011,BrewDog revenues double as craft beer boom accelerates in the UK,"BrewDog has reported a near-doubling of revenues in its latest financial year, with turnover rising to approximately £2.8 million as consumer demand for craft beer continues to outstrip expectations. The company's direct-to-consumer channel, driven by the Equity for Punks investor community, now accounts for a significant proportion of sales. Gross margins have improved following investment in the Fraserburgh bottling line funded by the first crowdfunding round. Management has signalled that a second Equity for Punks round is under consideration to fund further capacity expansion and geographic growth into new UK cities.",Business,positive
10,2011-04-17,2011,Punk ethos drives BrewDog's unconventional marketing strategy,"BrewDog has carved out a distinctive market position through a series of deliberately provocative marketing campaigns that have generated substantial earned media coverage and consumer buzz. The brewery's willingness to court controversy has helped it achieve brand awareness far exceeding what its modest marketing budget would normally allow. Consumer surveys indicate that BrewDog drinkers have exceptionally high brand affinity scores, a key driver of the direct sales and crowdfunding models that underpin the company's growth strategy. Marketing professionals have cited the company as a case study in disruptive challenger brand tactics that other consumer businesses are beginning to emulate.",Business,positive
11,2011-06-30,2011,BrewDog signs first export deal with US craft beer distributor,"BrewDog has secured its first significant export partnership with a specialist craft beer distributor covering the northeastern United States, marking a major step in the company's international expansion strategy. The agreement will see Punk IPA and a selection of other core beers distributed to specialist craft beer retailers and bars in New York and Massachusetts. International revenue remains a small proportion of total turnover but management believes the US market represents the single largest growth opportunity for the brand over the medium term. Co-founder James Watt described the US as the spiritual home of the craft beer revolution that BrewDog is now bringing back to its birthplace.",Business,positive
12,2011-09-05,2011,Second Equity for Punks round opens seeking £2.2 million,"BrewDog has launched its second Equity for Punks crowdfunding round, seeking to raise £2.2 million from retail investors to fund continued growth. The raise will support a planned new brewpub in London, further capacity expansion at Fraserburgh and the hiring of thirty additional staff. The company reports that over sixty percent of the new round has been pre-committed by existing shareholder-investors, demonstrating strong loyalty within the punk community. Financial analysts following the craft sector note that BrewDog's ability to raise growth capital at scale through crowdfunding represents a genuine innovation in SME finance that other consumer brands are beginning to emulate.",Finance,positive
13,2011-11-22,2011,BrewDog named fastest-growing food and drink firm in Scotland,"BrewDog has topped the annual Insider Fast Track 100 ranking of Scotland's fastest-growing food and drink businesses, with compound annual revenue growth exceeding eighty percent over the past two years. The award underscores the brewery's emergence as one of the most dynamic companies in the UK consumer sector. The company now employs over fifty people and operates four bars across Scotland and England. Investors in the Equity for Punks rounds have seen the notional value of their holdings increase substantially, though shares remain illiquid given the company's private status.",Business,positive
14,2011-12-10,2011,BrewDog opens London Shoreditch bar to strong demand,"BrewDog's first London venue has opened in Shoreditch to queues stretching down the street, as the capital's large and enthusiastic craft beer community embraces the Scottish brewer's arrival. The bar, which operates forty-two taps and a bottle shop, broke the company's single-day sales record on its opening weekend. The London market is expected to contribute meaningfully to the bar estate revenue line from the first full quarter of trading. Management sees London as the gateway to international tourism and media exposure that will amplify the BrewDog brand globally and attract further investment interest.",Food,positive
15,2011-03-12,2011,BrewDog's direct-to-consumer model outperforms industry peers,"A review of the UK speciality drinks retail market by Verdict Research has highlighted BrewDog's direct-to-consumer model as the most effective in the sector, generating higher average order values, greater customer retention and superior lifetime customer revenues compared to competing brands. The model, underpinned by the Equity for Punks shareholder-investor community, creates a captive consumer base with strong brand loyalty and above-average purchasing frequency. The review recommends the model as a template for other premium consumer brands seeking to build sustainable direct revenue channels outside of traditional wholesale distribution.",Business,positive
16,2011-07-19,2011,BrewDog exports reach seven countries as international demand grows,"BrewDog has announced that its beers are now distributed in seven countries, up from two just twelve months ago, as international demand for the BrewDog brand accelerates. Export revenues represent approximately eight percent of total turnover, with the United States, Sweden and Australia the largest international markets. The company has appointed a dedicated export sales manager to handle growing distributor relationships. Management believes that the global craft beer market is still in its early stages of development, creating significant headroom for a well-positioned brand with BrewDog's growing international recognition.",Business,positive
17,2012-03-08,2012,BrewDog targets £4 million in Equity for Punks III raise,"BrewDog has announced the third iteration of its Equity for Punks crowdfunding programme, targeting £4 million from existing and new retail investors. The company plans to use the proceeds to open five new bars across the UK, upgrade the Fraserburgh brewing facility and invest in a new digital platform for direct-to-consumer e-commerce sales. Total shareholder numbers in the Equity for Punks scheme are approaching 8,000 individuals, making it one of the largest equity crowdfunding communities in the UK. The company's revenues have grown to approximately £7 million and management has outlined a credible path to profitability within two financial years.",Finance,positive
18,2012-05-14,2012,James Watt interview: building a business on beer and attitude,"BrewDog co-founder James Watt has given a wide-ranging interview in which he outlined his vision for the company as a global craft beer brand with a social mission to improve drinking culture. Watt described the company's disruptive approach to marketing, retail and finance as a deliberate rejection of the corporate norms that stifle innovation in the drinks industry. He acknowledged that rapid growth had created operational challenges but insisted that the company's culture of openness and employee ownership was the foundation of its competitive advantage. The interview has been widely shared within the craft beer and start-up communities, reinforcing BrewDog's status as a flagship British entrepreneurial success story.",Business,positive
19,2012-07-20,2012,BrewDog marketing stunt causes regulatory stir but drives sales,"BrewDog has once again attracted the attention of the Advertising Standards Authority following complaints about the labelling and marketing of a new limited-edition beer. The brewery's management has defended the campaign as consistent with its punk values and right to free expression, noting that the resulting publicity has driven a spike in online sales. The company has developed a pattern of using regulatory friction as a marketing tool, generating earned media coverage that amplifies brand awareness without paid advertising expenditure. Some industry observers have questioned whether this strategy carries long-term reputational risk, while others view it as a sophisticated and cost-effective guerrilla marketing approach.",UK News,neutral
20,2012-10-03,2012,BrewDog exports reach twelve countries as international demand grows,"BrewDog has announced that its beers are now distributed in twelve countries, up from seven just twelve months ago, as international demand for the BrewDog brand accelerates rapidly. Export revenues now represent approximately fifteen percent of total turnover, with the United States, Sweden and Australia the largest international markets. The company has appointed a dedicated head of international sales to manage distribution relationships and identify new market opportunities. Management believes that the global craft beer market is still in its early stages of development, creating significant headroom for a well-positioned premium brand.",Business,positive
21,2012-01-18,2012,BrewDog crowdfunding model attracts academic and investor interest,"Business schools at Harvard and London Business School have both included BrewDog's Equity for Punks model as a case study in their entrepreneurial finance programmes. The case studies examine how the model combines capital raising with community building and brand development, and evaluate its advantages and limitations relative to traditional venture capital funding. A feature in the Financial Times has highlighted the scheme as a significant innovation in SME capital raising that is being studied by entrepreneurs across the consumer sector. The company has now raised over £6 million from retail investors across three crowdfunding rounds.",Finance,positive
22,2012-04-25,2012,BrewDog wins supermarket listing with Tesco and Waitrose,"BrewDog has secured significant new retail listings with Tesco and Waitrose, bringing the brand's core products to mainstream UK supermarket shelves for the first time. The listings represent a major distribution breakthrough expected to contribute meaningfully to wholesale revenue growth in the current financial year. Some members of the Equity for Punks community have questioned whether mainstream retail is consistent with the company's punk brand values, but management has defended the move as essential for scaling the business. James Watt argued that making great craft beer accessible to all consumers, rather than a small metropolitan elite, was entirely consistent with the company's founding mission.",Business,positive
23,2012-08-29,2012,BrewDog opens Manchester and Leeds bars in northern expansion,"BrewDog has opened two new bars in Manchester and Leeds as part of an accelerating national expansion programme targeting major UK cities outside London. The openings are being funded from the proceeds of the third Equity for Punks crowdfunding round. Each new bar requires a capital investment of approximately £350,000 for fit-out and equipment, with payback periods of under three years at target trading levels. Management expects the expanded bar estate to become the largest single contributor to group revenue within twelve months, displacing wholesale distribution which has historically been the primary revenue channel for the business.",Food,positive
24,2012-12-01,2012,BrewDog's annual results show revenue growth of seventy percent,"BrewDog's latest annual results show revenue growth of seventy percent to approximately £12 million, driven by new bar openings, growth in export sales and the expanding direct-to-consumer channel. The results confirm the company's status as one of the fastest-growing consumer businesses in the UK. Gross margins have been maintained despite rising commodity costs, reflecting the premium pricing power of the brand and the high margin contribution of bar-based revenues. Management has raised its medium-term revenue target and outlined a plan to reach fifty million pounds in turnover within four years.",Finance,positive
25,2013-02-18,2013,BrewDog revenues hit £10 million milestone ahead of schedule,"BrewDog has reached the £10 million annual revenue mark ahead of its internal targets, reflecting strong growth across all channels including the bar estate, direct-to-consumer online sales and wholesale distribution. The company now employs over 120 people and operates eight bars across the UK. Gross margins have remained stable despite rising ingredient costs, reflecting the premium pricing power of the BrewDog brand. The milestone has been celebrated internally as confirmation of the company's viability as a substantial business rather than a niche craft curiosity, and management has raised its medium-term revenue target to £50 million.",Business,positive
26,2013-04-25,2013,BrewDog AGM gives investors voice in company strategy for first time,"BrewDog has held its first formal Annual General Meeting for Equity for Punks investors, bringing together over 800 shareholder-investors in Fraserburgh for a day of presentations, Q&A and product tastings. The event reflects the company's commitment to transparency and genuine engagement with its retail investor community. Shareholders voted on non-binding resolutions including the company's sustainability strategy and bar opening programme. Management committed to holding the AGM annually and to providing increasing levels of financial transparency to investors. The event has been praised in the financial press as an innovative approach to shareholder relations for a private company.",Finance,positive
27,2013-06-12,2013,BrewDog announces plans for Columbus Ohio US brewery,"BrewDog has confirmed plans to build a dedicated US brewing facility in Columbus, Ohio, marking a transformative step in its international expansion strategy. The US brewery will allow the company to serve the American market with fresh beer brewed locally, avoiding the quality and cost penalties associated with transatlantic shipping. Management estimates the investment will require approximately $30 million in capital, to be funded through a combination of equity crowdfunding, bank debt and potential institutional investment. The Columbus location was chosen for its central location, craft beer culture and access to skilled brewing talent, according to co-founder Martin Dickie.",Business,positive
28,2013-08-29,2013,Equity for Punks IV targets record £4.25 million from investors,"BrewDog has opened its fourth Equity for Punks crowdfunding round, seeking to raise £4.25 million to fund the US brewery project and continued UK bar openings. The round attracted £1 million in investment within the first forty-eight hours, a record pace for the scheme. The company now has over 13,000 shareholder-investors across its crowdfunding rounds. The raise reflects sustained investor appetite for a consumer brand that has delivered consistent revenue growth and expanded its operational footprint significantly since the first Equity for Punks round in 2010.",Finance,positive
29,2013-10-15,2013,BrewDog's bar estate model hailed as template for experiential retail,"A report by retail analysts at Mintel has highlighted BrewDog's owned bar network as an exemplar of the experiential retail trend transforming the consumer sector. The analysis notes that BrewDog bars generate superior revenue per square foot compared to conventional pub formats, driven by premium pricing, high-margin merchandise sales and events programming. The company plans to open a further ten bars in the next twelve months, targeting cities including Birmingham, Bristol and Glasgow. Management describes the bar estate as the core of a vertically integrated business model that controls product quality and brand experience from grain to glass.",Food,positive
30,2013-11-07,2013,BrewDog named one of Sunday Times top small companies to work for,"BrewDog has been recognised in the Sunday Times list of top small companies to work for, with employees praising the company's culture of openness, shared ownership and genuine passion for the product. The listing highlights BrewDog's employee share scheme, flexible working practices and investment in staff training and development. The recognition comes as the company continues to hire aggressively to support its rapid growth, adding over fifty new positions in the past year. Management has cited recruitment and talent retention as among its most significant operational challenges as it scales in a competitive labour market.",Business,positive
31,2013-03-22,2013,BrewDog's craft beer range wins multiple industry awards,"BrewDog has swept a series of industry awards at the Society of Independent Brewers conference, with Punk IPA, Dead Pony Club and 5AM Saint all receiving gold medals in their respective categories. The recognition adds to a growing portfolio of product accolades that provide third-party validation of the company's quality credentials. Consumer magazine Which? has also named Punk IPA as one of the top-rated beers in the UK market, scoring highly on both flavour and perceived value. Management believes that continued investment in product quality and the distinctive brand voice will sustain premium pricing as the market becomes more crowded.",Food,positive
32,2013-07-04,2013,BrewDog secures £3 million bank facility to fund expansion,"BrewDog has secured a £3 million revolving credit facility from the Royal Bank of Scotland to support its ongoing expansion programme. The bank financing, combined with equity crowdfunding proceeds, gives the company a diversified capital structure appropriate for a business of its scale and growth ambitions. The facility will be used to fund fit-out costs for new bar openings and bridge working capital requirements during periods of rapid inventory growth. The company's improving revenue trajectory and positive cash generation from its bar estate have given mainstream lenders confidence in the business model and underpinned the credit decision.",Finance,positive
33,2013-12-20,2013,BrewDog's punk beer hits shelves in twenty countries worldwide,"BrewDog now distributes its core range of craft beers in twenty countries, up from twelve at the same point in 2012, as the company's international expansion programme delivers tangible results. Export revenues have grown to represent approximately twenty percent of total turnover. The company has established distributor relationships in key European markets including Germany, France, Italy and Spain, and is building its presence in Australia and East Asia. Management believes that the company is well positioned to capitalise on the global craft beer trend, which consultancy McKinsey has described as one of the most significant structural shifts in the consumer beverages sector.",Business,positive
34,2014-01-30,2014,"BrewDog's Ellon expansion doubles brewing capacity to 120,000 hectolitres","A major capacity expansion at BrewDog's Ellon brewery, funded by earlier Equity for Punks rounds, has come online, doubling the site's annual production capacity to 120,000 hectolitres. The expansion includes new fermentation vessels, an upgraded packaging line and enhanced quality control laboratories. The additional capacity will allow the company to meet growing domestic wholesale demand and significantly increase export volumes. Management has described the Ellon expansion as the single most important operational investment in the company's history, providing the production platform for the next phase of revenue growth and international distribution.",Business,positive
